03:31:55.253302 d4:1b:81:ac:5b:29 > 20:0c:86:b9:be:60, ethertype IPv4 (0x0800), length 76: 192.168.1.28.36837 > 192.168.1.1.53: 58245+ A? static.figma.com. (34)
03:31:55.253378 d4:1b:81:ac:5b:29 > 20:0c:86:b9:be:60, ethertype IPv4 (0x0800), length 76: 192.168.1.28.47006 > 192.168.1.1.53: 6131+ HTTPS? static.figma.com. (34)
03:31:55.290113 20:0c:86:b9:be:60 > d4:1b:81:ac:5b:29, ethertype IPv4 (0x0800), length 203: 192.168.1.1.53 > 192.168.1.28.47006: 6131 1/1/0 CNAME d3otp6i141k5zo.cloudfront.net. (161)
03:31:55.290939 20:0c:86:b9:be:60 > d4:1b:81:ac:5b:29, ethertype IPv4 (0x0800), length 493: 192.168.1.1.53 > 192.168.1.28.36837: 58245 5/4/8 CNAME d3otp6i141k5zo.cloudfront.net., A 18.66.78.59, A 18.66.78.51, A 18.66.78.100, A 18.66.78.89 (451)
03:31:55.291606 d4:1b:81:ac:5b:29 > 20:0c:86:b9:be:60, ethertype IPv4 (0x0800), length 1292: 192.168.1.28.56785 > 18.66.78.59.443: UDP, length 1250
03:31:55.291645 d4:1b:81:ac:5b:29 > 20:0c:86:b9:be:60, ethertype IPv4 (0x0800), length 1292: 192.168.1.28.56785 > 18.66.78.59.443: UDP, length 1250
03:31:55.298215 20:0c:86:b9:be:60 > d4:1b:81:ac:5b:29, ethertype IPv4 (0x0800), length 1242: 18.66.78.59.443 > 192.168.1.28.56785: UDP, length 1200
03:31:55.301574 20:0c:86:b9:be:60 > d4:1b:81:ac:5b:29, ethertype IPv4 (0x0800), length 1242: 18.66.78.59.443 > 192.168.1.28.56785: UDP, length 1200
03:31:55.301575 20:0c:86:b9:be:60 > d4:1b:81:ac:5b:29, ethertype IPv4 (0x0800), length 1242: 18.66.78.59.443 > 192.168.1.28.56785: UDP, length 1200
03:31:55.301575 20:0c:86:b9:be:60 > d4:1b:81:ac:5b:29, ethertype IPv4 (0x0800), length 1242: 18.66.78.59.443 > 192.168.1.28.56785: UDP, length 1200
03:31:55.301575 20:0c:86:b9:be:60 > d4:1b:81:ac:5b:29, ethertype IPv4 (0x0800), length 1242: 18.66.78.59.443 > 192.168.1.28.56785: UDP, length 1200
03:31:55.301575 20:0c:86:b9:be:60 > d4:1b:81:ac:5b:29, ethertype IPv4 (0x0800), length 996: 18.66.78.59.443 > 192.168.1.28.56785: UDP, length 954
03:31:55.301713 d4:1b:81:ac:5b:29 > 20:0c:86:b9:be:60, ethertype IPv4 (0x0800), length 93: 192.168.1.28.56785 > 18.66.78.59.443: UDP, length 51
03:31:55.301750 d4:1b:81:ac:5b:29 > 20:0c:86:b9:be:60, ethertype IPv4 (0x0800), length 93: 192.168.1.28.56785 > 18.66.78.59.443: UDP, length 51
03:31:55.301956 d4:1b:81:ac:5b:29 > 20:0c:86:b9:be:60, ethertype IPv4 (0x0800), length 215: 192.168.1.28.56785 > 18.66.78.59.443: UDP, length 173
03:31:55.302046 d4:1b:81:ac:5b:29 > 20:0c:86:b9:be:60, ethertype IPv4 (0x0800), length 535: 192.168.1.28.56785 > 18.66.78.59.443: UDP, length 493
03:31:55.310435 20:0c:86:b9:be:60 > d4:1b:81:ac:5b:29, ethertype IPv4 (0x0800), length 1494: 18.66.78.59.443 > 192.168.1.28.56785: UDP, length 1452
03:31:55.310435 20:0c:86:b9:be:60 > d4:1b:81:ac:5b:29, ethertype IPv4 (0x0800), length 106: 18.66.78.59.443 > 192.168.1.28.56785: UDP, length 64
03:31:55.310435 20:0c:86:b9:be:60 > d4:1b:81:ac:5b:29, ethertype IPv4 (0x0800), length 85: 18.66.78.59.443 > 192.168.1.28.56785: UDP, length 43
03:31:55.310435 20:0c:86:b9:be:60 > d4:1b:81:ac:5b:29, ethertype IPv4 (0x0800), length 654: 18.66.78.59.443 > 192.168.1.28.56785: UDP, length 612
03:31:55.310622 d4:1b:81:ac:5b:29 > 20:0c:86:b9:be:60, ethertype IPv4 (0x0800), length 85: 192.168.1.28.56785 > 18.66.78.59.443: UDP, length 43
03:31:55.310737 d4:1b:81:ac:5b:29 > 20:0c:86:b9:be:60, ethertype IPv4 (0x0800), length 85: 192.168.1.28.56785 > 18.66.78.59.443: UDP, length 43
03:31:55.316425 20:0c:86:b9:be:60 > d4:1b:81:ac:5b:29, ethertype IPv4 (0x0800), length 85: 18.66.78.59.443 > 192.168.1.28.56785: UDP, length 43
03:31:56.413195 d4:1b:81:ac:5b:29 > 20:0c:86:b9:be:60, ethertype IPv4 (0x0800), length 92: 192.168.1.28.47236 > 192.168.1.1.53: 9575+ A? mobile.events.data.microsoft.com. (50)
03:31:56.413233 d4:1b:81:ac:5b:29 > 20:0c:86:b9:be:60, ethertype IPv4 (0x0800), length 92: 192.168.1.28.65393 > 192.168.1.1.53: 20848+ HTTPS? mobile.events.data.microsoft.com. (50)
03:31:56.413349 d4:1b:81:ac:5b:29 > 20:0c:86:b9:be:60, ethertype IPv4 (0x0800), length 183: 192.168.1.28.56024 > 52.182.143.210.443: Flags [P.], seq 516564117:516564234, ack 3572089569, win 564, options [nop,nop,TS val 139452673 ecr 161218693], length 117
03:31:56.413378 d4:1b:81:ac:5b:29 > 20:0c:86:b9:be:60, ethertype IPv4 (0x0800), length 1494: 192.168.1.28.56024 > 52.182.143.210.443: Flags [.], seq 117:1545, ack 1, win 564, options [nop,nop,TS val 139452673 ecr 161218693], length 1428
03:31:56.413379 d4:1b:81:ac:5b:29 > 20:0c:86:b9:be:60, ethertype IPv4 (0x0800), length 1494: 192.168.1.28.56024 > 52.182.143.210.443: Flags [P.], seq 1545:2973, ack 1, win 564, options [nop,nop,TS val 139452673 ecr 161218693], length 1428
03:31:56.415744 d4:1b:81:ac:5b:29 > 20:0c:86:b9:be:60, ethertype IPv4 (0x0800), length 1115: 192.168.1.28.56024 > 52.182.143.210.443: Flags [P.], seq 2973:4022, ack 1, win 564, options [nop,nop,TS val 139452675 ecr 161218693], length 1049
03:31:56.521599 20:0c:86:b9:be:60 > d4:1b:81:ac:5b:29, ethertype IPv4 (0x0800), length 482: 192.168.1.1.53 > 192.168.1.28.47236: 9575 3/4/6 CNAME mobile.events.data.trafficmanager.net., CNAME onedscolprdcus02.centralus.cloudapp.azure.com., A 20.44.10.122 (440)
03:31:56.521599 20:0c:86:b9:be:60 > d4:1b:81:ac:5b:29, ethertype IPv4 (0x0800), length 260: 192.168.1.1.53 > 192.168.1.28.65393: 20848 2/1/0 CNAME mobile.events.data.trafficmanager.net., CNAME onedscolprdcus02.centralus.cloudapp.azure.com. (218)
03:31:56.570932 d4:1b:81:ac:5b:29 > 8a:75:31:15:cb:3e, ethertype IPv4 (0x0800), length 66: 192.168.1.28.1717 > 192.168.1.10.48876: Flags [.], ack 146590059, win 3864, options [nop,nop,TS val 3893612544 ecr 308761969], length 0
03:31:56.653146 20:0c:86:b9:be:60 > d4:1b:81:ac:5b:29, ethertype IPv4 (0x0800), length 66: 52.182.143.210.443 > 192.168.1.28.56024: Flags [.], ack 1545, win 16385, options [nop,nop,TS val 161263095 ecr 139452673], length 0
03:31:56.653522 20:0c:86:b9:be:60 > d4:1b:81:ac:5b:29, ethertype IPv4 (0x0800), length 66: 52.182.143.210.443 > 192.168.1.28.56024: Flags [.], ack 4022, win 16385, options [nop,nop,TS val 161263096 ecr 139452673], length 0
03:31:56.654954 20:0c:86:b9:be:60 > d4:1b:81:ac:5b:29, ethertype IPv4 (0x0800), length 105: 52.182.143.210.443 > 192.168.1.28.56024: Flags [P.], seq 1:40, ack 4022, win 16385, options [nop,nop,TS val 161263097 ecr 139452673], length 39
03:31:56.692204 8a:75:31:15:cb:3e > d4:1b:81:ac:5b:29, ethertype IPv4 (0x0800), length 66: 192.168.1.10.48876 > 192.168.1.28.1717: Flags [.], ack 1, win 212, options [nop,nop,TS val 308763681 ecr 3893417664], length 0
03:31:56.698888 d4:1b:81:ac:5b:29 > 20:0c:86:b9:be:60, ethertype IPv4 (0x0800), length 66: 192.168.1.28.56024 > 52.182.143.210.443: Flags [.], ack 40, win 564, options [nop,nop,TS val 139452959 ecr 161263097], length 0
03:31:56.938076 20:0c:86:b9:be:60 > d4:1b:81:ac:5b:29, ethertype IPv4 (0x0800), length 165: 52.182.143.210.443 > 192.168.1.28.56024: Flags [P.], seq 40:139, ack 4022, win 16385, options [nop,nop,TS val 161263380 ecr 139452959], length 99
03:31:56.938104 d4:1b:81:ac:5b:29 > 20:0c:86:b9:be:60, ethertype IPv4 (0x0800), length 66: 192.168.1.28.56024 > 52.182.143.210.443: Flags [.], ack 139, win 564, options [nop,nop,TS val 139453198 ecr 161263380], length 0
03:31:56.939032 d4:1b:81:ac:5b:29 > 20:0c:86:b9:be:60, ethertype IPv4 (0x0800), length 101: 192.168.1.28.56024 > 52.182.143.210.443: Flags [P.], seq 4022:4057, ack 139, win 564, options [nop,nop,TS val 139453199 ecr 161263380], length 35
03:31:57.321534 20:0c:86:b9:be:60 > d4:1b:81:ac:5b:29, ethertype IPv4 (0x0800), length 66: 52.182.143.210.443 > 192.168.1.28.56024: Flags [.], ack 4057, win 16385, options [nop,nop,TS val 161263675 ecr 139453199], length 0
03:31:57.730054 20:0c:86:b9:be:60 > 33:33:ff:00:00:01, ethertype IPv6 (0x86dd), length 86: fe80::1 > ff02::1:ff00:1: HBH ICMP6, multicast listener reportmax resp delay: 0 addr: ff02::1:ff00:1, length 24
03:31:57.732186 20:0c:86:b9:be:60 > 33:33:ff:00:00:01, ethertype IPv6 (0x86dd), length 86: fe80::1 > ff02::1:ff00:1: HBH ICMP6, multicast listener reportmax resp delay: 0 addr: ff02::1:ff00:1, length 24
03:31:57.733501 20:0c:86:b9:be:60 > 33:33:ff:00:00:01, ethertype IPv6 (0x86dd), length 86: fe80::1 > ff02::1:ff00:1: HBH ICMP6, multicast listener reportmax resp delay: 0 addr: ff02::1:ff00:1, length 24
03:31:58.446756 20:0c:86:b9:be:60 > 33:33:ff:00:00:00, ethertype IPv6 (0x86dd), length 86: fe80::1 > ff02::1:ff00:0: HBH ICMP6, multicast listener reportmax resp delay: 0 addr: ff02::1:ff00:0, length 24
03:31:58.448924 20:0c:86:b9:be:60 > 33:33:ff:00:00:00, ethertype IPv6 (0x86dd), length 86: fe80::1 > ff02::1:ff00:0: HBH ICMP6, multicast listener reportmax resp delay: 0 addr: ff02::1:ff00:0, length 24
03:31:58.450185 20:0c:86:b9:be:60 > 33:33:ff:00:00:00, ethertype IPv6 (0x86dd), length 86: fe80::1 > ff02::1:ff00:0: HBH ICMP6, multicast listener reportmax resp delay: 0 addr: ff02::1:ff00:0, length 24
03:31:59.453623 d4:1b:81:ac:5b:29 > 20:0c:86:b9:be:60, ethertype IPv4 (0x0800), length 184: 192.168.1.28.56024 > 52.182.143.210.443: Flags [P.], seq 4057:4175, ack 139, win 564, options [nop,nop,TS val 139455713 ecr 161263675], length 118
03:31:59.456262 d4:1b:81:ac:5b:29 > 20:0c:86:b9:be:60, ethertype IPv4 (0x0800), length 1494: 192.168.1.28.56024 > 52.182.143.210.443: Flags [.], seq 4175:5603, ack 139, win 564, options [nop,nop,TS val 139455716 ecr 161263675], length 1428
03:31:59.456265 d4:1b:81:ac:5b:29 > 20:0c:86:b9:be:60, ethertype IPv4 (0x0800), length 1494: 192.168.1.28.56024 > 52.182.143.210.443: Flags [P.], seq 5603:7031, ack 139, win 564, options [nop,nop,TS val 139455716 ecr 161263675], length 1428
03:31:59.459298 d4:1b:81:ac:5b:29 > 20:0c:86:b9:be:60, ethertype IPv4 (0x0800), length 1494: 192.168.1.28.56024 > 52.182.143.210.443: Flags [.], seq 7031:8459, ack 139, win 564, options [nop,nop,TS val 139455719 ecr 161263675], length 1428
03:31:59.459302 d4:1b:81:ac:5b:29 > 20:0c:86:b9:be:60, ethertype IPv4 (0x0800), length 1494: 192.168.1.28.56024 > 52.182.143.210.443: Flags [P.], seq 8459:9887, ack 139, win 564, options [nop,nop,TS val 139455719 ecr 161263675], length 1428
03:31:59.460951 d4:1b:81:ac:5b:29 > 20:0c:86:b9:be:60, ethertype IPv4 (0x0800), length 1494: 192.168.1.28.56024 > 52.182.143.210.443: Flags [.], seq 9887:11315, ack 139, win 564, options [nop,nop,TS val 139455721 ecr 161263675], length 1428
03:31:59.460956 d4:1b:81:ac:5b:29 > 20:0c:86:b9:be:60, ethertype IPv4 (0x0800), length 632: 192.168.1.28.56024 > 52.182.143.210.443: Flags [P.], seq 11315:11881, ack 139, win 564, options [nop,nop,TS val 139455721 ecr 161263675], length 566
03:31:59.727323 20:0c:86:b9:be:60 > d4:1b:81:ac:5b:29, ethertype IPv4 (0x0800), length 78: 52.182.143.210.443 > 192.168.1.28.56024: Flags [.], ack 4057, win 16385, options [nop,nop,TS val 161266141 ecr 139453199,nop,nop,sack 1 {4175:5603}], length 0
03:31:59.727323 20:0c:86:b9:be:60 > d4:1b:81:ac:5b:29, ethertype IPv4 (0x0800), length 78: 52.182.143.210.443 > 192.168.1.28.56024: Flags [.], ack 4057, win 16385, options [nop,nop,TS val 161266141 ecr 139453199,nop,nop,sack 1 {4175:7031}], length 0
03:31:59.727323 20:0c:86:b9:be:60 > d4:1b:81:ac:5b:29, ethertype IPv4 (0x0800), length 78: 52.182.143.210.443 > 192.168.1.28.56024: Flags [.], ack 4057, win 16385, options [nop,nop,TS val 161266142 ecr 139453199,nop,nop,sack 1 {4175:8459}], length 0
03:31:59.727323 20:0c:86:b9:be:60 > d4:1b:81:ac:5b:29, ethertype IPv4 (0x0800), length 78: 52.182.143.210.443 > 192.168.1.28.56024: Flags [.], ack 4057, win 16385, options [nop,nop,TS val 161266142 ecr 139453199,nop,nop,sack 1 {4175:9887}], length 0
03:31:59.727323 20:0c:86:b9:be:60 > d4:1b:81:ac:5b:29, ethertype IPv4 (0x0800), length 78: 52.182.143.210.443 > 192.168.1.28.56024: Flags [.], ack 4057, win 16385, options [nop,nop,TS val 161266142 ecr 139453199,nop,nop,sack 1 {4175:11315}], length 0
03:31:59.727323 20:0c:86:b9:be:60 > d4:1b:81:ac:5b:29, ethertype IPv4 (0x0800), length 78: 52.182.143.210.443 > 192.168.1.28.56024: Flags [.], ack 4057, win 16385, options [nop,nop,TS val 161266143 ecr 139453199,nop,nop,sack 1 {4175:11881}], length 0
03:31:59.727356 d4:1b:81:ac:5b:29 > 20:0c:86:b9:be:60, ethertype IPv4 (0x0800), length 184: 192.168.1.28.56024 > 52.182.143.210.443: Flags [P.], seq 4057:4175, ack 139, win 564, options [nop,nop,TS val 139455987 ecr 161266142], length 118
03:31:59.979071 20:0c:86:b9:be:60 > d4:1b:81:ac:5b:29, ethertype IPv4 (0x0800), length 66: 52.182.143.210.443 > 192.168.1.28.56024: Flags [.], ack 11881, win 16385, options [nop,nop,TS val 161266410 ecr 139455987], length 0
03:31:59.979072 20:0c:86:b9:be:60 > d4:1b:81:ac:5b:29, ethertype IPv4 (0x0800), length 165: 52.182.143.210.443 > 192.168.1.28.56024: Flags [P.], seq 139:238, ack 11881, win 16385, options [nop,nop,TS val 161266410 ecr 139455987], length 99
03:32:00.022938 d4:1b:81:ac:5b:29 > 20:0c:86:b9:be:60, ethertype IPv4 (0x0800), length 66: 192.168.1.28.56024 > 52.182.143.210.443: Flags [.], ack 238, win 564, options [nop,nop,TS val 139456283 ecr 161266410], length 0
03:32:01.251349 d4:1b:81:ac:5b:29 > 20:0c:86:b9:be:60, ethertype IPv4 (0x0800), length 306: 192.168.1.28.60890 > 35.174.127.31.443: Flags [P.], seq 1178281079:1178281319, ack 803993595, win 521, options [nop,nop,TS val 1796091461 ecr 224684483], length 240
03:32:01.496193 20:0c:86:b9:be:60 > d4:1b:81:ac:5b:29, ethertype IPv4 (0x0800), length 329: 35.174.127.31.443 > 192.168.1.28.60890: Flags [P.], seq 1:264, ack 240, win 644, options [nop,nop,TS val 224700487 ecr 1796091461], length 263
03:32:01.496220 d4:1b:81:ac:5b:29 > 20:0c:86:b9:be:60, ethertype IPv4 (0x0800), length 66: 192.168.1.28.60890 > 35.174.127.31.443: Flags [.], ack 264, win 521, options [nop,nop,TS val 1796091706 ecr 224700487], length 0
03:32:02.458953 d4:1b:81:ac:5b:29 > 20:0c:86:b9:be:60, ethertype IPv4 (0x0800), length 66: 192.168.1.28.44866 > 23.9.210.112.443: Flags [.], ack 902275773, win 501, options [nop,nop,TS val 2023758800 ecr 2847196737], length 0
03:32:02.490076 20:0c:86:b9:be:60 > d4:1b:81:ac:5b:29, ethertype IPv4 (0x0800), length 66: 23.9.210.112.443 > 192.168.1.28.44866: Flags [.], ack 1, win 501, options [nop,nop,TS val 2847242306 ecr 2023668183], length 0
03:32:02.527901 d4:1b:81:ac:5b:29 > 20:0c:86:b9:be:60, ethertype IPv4 (0x0800), length 184: 192.168.1.28.56024 > 52.182.143.210.443: Flags [P.], seq 11881:11999, ack 238, win 564, options [nop,nop,TS val 139458788 ecr 161266410], length 118
03:32:02.527940 d4:1b:81:ac:5b:29 > 20:0c:86:b9:be:60, ethertype IPv4 (0x0800), length 1494: 192.168.1.28.56024 > 52.182.143.210.443: Flags [.], seq 11999:13427, ack 238, win 564, options [nop,nop,TS val 139458788 ecr 161266410], length 1428
03:32:02.527942 d4:1b:81:ac:5b:29 > 20:0c:86:b9:be:60, ethertype IPv4 (0x0800), length 1494: 192.168.1.28.56024 > 52.182.143.210.443: Flags [P.], seq 13427:14855, ack 238, win 564, options [nop,nop,TS val 139458788 ecr 161266410], length 1428
03:32:02.536613 d4:1b:81:ac:5b:29 > 20:0c:86:b9:be:60, ethertype IPv4 (0x0800), length 1078: 192.168.1.28.56024 > 52.182.143.210.443: Flags [P.], seq 14855:15867, ack 238, win 564, options [nop,nop,TS val 139458796 ecr 161266410], length 1012
03:32:02.748550 8a:75:31:15:cb:3e > d4:1b:81:ac:5b:29, ethertype IPv4 (0x0800), length 279: 192.168.1.10.48876 > 192.168.1.28.1717: Flags [P.], seq 1:214, ack 1, win 212, options [nop,nop,TS val 308768556 ecr 3893417664], length 213
03:32:02.748577 d4:1b:81:ac:5b:29 > 8a:75:31:15:cb:3e, ethertype IPv4 (0x0800), length 66: 192.168.1.28.1717 > 192.168.1.10.48876: Flags [.], ack 214, win 3863, options [nop,nop,TS val 3893618721 ecr 308768556], length 0
03:32:02.753924 8a:75:31:15:cb:3e > d4:1b:81:ac:5b:29, ethertype IPv4 (0x0800), length 279: 192.168.1.10.48876 > 192.168.1.28.1717: Flags [P.], seq 214:427, ack 1, win 212, options [nop,nop,TS val 308768563 ecr 3893618721], length 213
03:32:02.753957 d4:1b:81:ac:5b:29 > 8a:75:31:15:cb:3e, ethertype IPv4 (0x0800), length 66: 192.168.1.28.1717 > 192.168.1.10.48876: Flags [.], ack 427, win 3862, options [nop,nop,TS val 3893618727 ecr 308768563], length 0
03:32:02.773515 20:0c:86:b9:be:60 > d4:1b:81:ac:5b:29, ethertype IPv4 (0x0800), length 66: 52.182.143.210.443 > 192.168.1.28.56024: Flags [.], ack 14855, win 16385, options [nop,nop,TS val 161269215 ecr 139458788], length 0
03:32:02.774342 20:0c:86:b9:be:60 > d4:1b:81:ac:5b:29, ethertype IPv4 (0x0800), length 66: 52.182.143.210.443 > 192.168.1.28.56024: Flags [.], ack 15867, win 16381, options [nop,nop,TS val 161269216 ecr 139458796], length 0
03:32:02.774954 20:0c:86:b9:be:60 > d4:1b:81:ac:5b:29, ethertype IPv4 (0x0800), length 160: 52.182.143.210.443 > 192.168.1.28.56024: Flags [P.], seq 238:332, ack 15867, win 16381, options [nop,nop,TS val 161269216 ecr 139458796], length 94
03:32:02.774963 d4:1b:81:ac:5b:29 > 20:0c:86:b9:be:60, ethertype IPv4 (0x0800), length 66: 192.168.1.28.56024 > 52.182.143.210.443: Flags [.], ack 332, win 564, options [nop,nop,TS val 139459035 ecr 161269216], length 0
03:32:02.775803 d4:1b:81:ac:5b:29 > 20:0c:86:b9:be:60, ethertype IPv4 (0x0800), length 101: 192.168.1.28.56024 > 52.182.143.210.443: Flags [P.], seq 15867:15902, ack 332, win 564, options [nop,nop,TS val 139459035 ecr 161269216], length 35
03:32:03.182632 20:0c:86:b9:be:60 > d4:1b:81:ac:5b:29, ethertype IPv4 (0x0800), length 66: 52.182.143.210.443 > 192.168.1.28.56024: Flags [.], ack 15902, win 16381, options [nop,nop,TS val 161269503 ecr 139459035], length 0
03:32:03.570432 20:0c:86:b9:be:60 > 33:33:00:00:00:02, ethertype IPv6 (0x86dd), length 86: fe80::1 > ff02::2: HBH ICMP6, multicast listener reportmax resp delay: 0 addr: ff02::2, length 24
03:32:03.772283 26:b0:14:8a:0f:cf > d4:1b:81:ac:5b:29, ethertype IPv4 (0x0800), length 91: 192.168.1.6.5353 > 224.0.0.251.5353: 0 [2q] PTR (QU)? _airplay._tcp.local. PTR (QU)? _raop._tcp.local. (49)
03:32:03.772283 26:b0:14:8a:0f:cf > d4:1b:81:ac:5b:29, ethertype IPv6 (0x86dd), length 111: fe80::482:f5a0:bf3:b66c.5353 > ff02::fb.5353: 0 [2q] PTR (QU)? _airplay._tcp.local. PTR (QU)? _raop._tcp.local. (49)
03:32:04.078912 8a:75:31:15:cb:3e > d4:1b:81:ac:5b:29, ethertype IPv4 (0x0800), length 167: 192.168.1.10.44791 > 239.255.255.250.1900: UDP, length 125
03:32:04.378080 8a:75:31:15:cb:3e > d4:1b:81:ac:5b:29, ethertype IPv4 (0x0800), length 167: 192.168.1.10.44791 > 239.255.255.250.1900: UDP, length 125
03:32:04.696277 8a:75:31:15:cb:3e > d4:1b:81:ac:5b:29, ethertype IPv4 (0x0800), length 167: 192.168.1.10.44791 > 239.255.255.250.1900: UDP, length 125
03:32:04.760851 26:b0:14:8a:0f:cf > d4:1b:81:ac:5b:29, ethertype IPv4 (0x0800), length 91: 192.168.1.6.5353 > 224.0.0.251.5353: 0 [2q] PTR (QM)? _airplay._tcp.local. PTR (QM)? _raop._tcp.local. (49)
03:32:04.807083 26:b0:14:8a:0f:cf > d4:1b:81:ac:5b:29, ethertype IPv6 (0x86dd), length 111: fe80::482:f5a0:bf3:b66c.5353 > ff02::fb.5353: 0 [2q] PTR (QM)? _airplay._tcp.local. PTR (QM)? _raop._tcp.local. (49)
03:32:05.026915 8a:75:31:15:cb:3e > d4:1b:81:ac:5b:29, ethertype IPv4 (0x0800), length 279: 192.168.1.10.48876 > 192.168.1.28.1717: Flags [P.], seq 427:640, ack 1, win 212, options [nop,nop,TS val 308770835 ecr 3893618727], length 213
03:32:05.026944 d4:1b:81:ac:5b:29 > 8a:75:31:15:cb:3e, ethertype IPv4 (0x0800), length 66: 192.168.1.28.1717 > 192.168.1.10.48876: Flags [.], ack 640, win 3861, options [nop,nop,TS val 3893621000 ecr 308770835], length 0
03:32:05.064219 8a:75:31:15:cb:3e > d4:1b:81:ac:5b:29, ethertype IPv4 (0x0800), length 279: 192.168.1.10.48876 > 192.168.1.28.1717: Flags [P.], seq 640:853, ack 1, win 212, options [nop,nop,TS val 308770858 ecr 3893621000], length 213
03:32:05.064246 d4:1b:81:ac:5b:29 > 8a:75:31:15:cb:3e, ethertype IPv4 (0x0800), length 66: 192.168.1.28.1717 > 192.168.1.10.48876: Flags [.], ack 853, win 3860, options [nop,nop,TS val 3893621037 ecr 308770858], length 0
03:32:05.097203 8a:75:31:15:cb:3e > d4:1b:81:ac:5b:29, ethertype IPv4 (0x0800), length 279: 192.168.1.10.48876 > 192.168.1.28.1717: Flags [P.], seq 853:1066, ack 1, win 212, options [nop,nop,TS val 308770900 ecr 3893621037], length 213
03:32:05.097230 d4:1b:81:ac:5b:29 > 8a:75:31:15:cb:3e, ethertype IPv4 (0x0800), length 66: 192.168.1.28.1717 > 192.168.1.10.48876: Flags [.], ack 1066, win 3859, options [nop,nop,TS val 3893621070 ecr 308770900], length 0
03:32:05.596225 d4:1b:81:ac:5b:29 > 20:0c:86:b9:be:60, ethertype IPv4 (0x0800), length 181: 192.168.1.28.56024 > 52.182.143.210.443: Flags [P.], seq 15902:16017, ack 332, win 564, options [nop,nop,TS val 139461856 ecr 161269503], length 115
03:32:05.596364 d4:1b:81:ac:5b:29 > 20:0c:86:b9:be:60, ethertype IPv4 (0x0800), length 1494: 192.168.1.28.56024 > 52.182.143.210.443: Flags [.], seq 16017:17445, ack 332, win 564, options [nop,nop,TS val 139461856 ecr 161269503], length 1428
03:32:05.596365 d4:1b:81:ac:5b:29 > 20:0c:86:b9:be:60, ethertype IPv4 (0x0800), length 1494: 192.168.1.28.56024 > 52.182.143.210.443: Flags [P.], seq 17445:18873, ack 332, win 564, options [nop,nop,TS val 139461856 ecr 161269503], length 1428
03:32:05.598242 d4:1b:81:ac:5b:29 > 20:0c:86:b9:be:60, ethertype IPv4 (0x0800), length 1078: 192.168.1.28.56024 > 52.182.143.210.443: Flags [P.], seq 18873:19885, ack 332, win 564, options [nop,nop,TS val 139461858 ecr 161269503], length 1012
03:32:05.819453 20:0c:86:b9:be:60 > 01:00:5e:00:00:01, ethertype IPv4 (0x0800), length 46: 0.0.0.0 > 224.0.0.1: igmp query v2
03:32:05.820616 20:0c:86:b9:be:60 > 01:00:5e:00:00:01, ethertype IPv4 (0x0800), length 46: 0.0.0.0 > 224.0.0.1: igmp query v2
03:32:05.821582 20:0c:86:b9:be:60 > 01:00:5e:00:00:01, ethertype IPv4 (0x0800), length 46: 0.0.0.0 > 224.0.0.1: igmp query v2
03:32:05.822927 20:0c:86:b9:be:60 > 33:33:00:00:00:01, ethertype IPv6 (0x86dd), length 86: fe80::1 > ff02::1: HBH ICMP6, multicast listener querymax resp delay: 10000 addr: ::, length 24
03:32:05.925003 20:0c:86:b9:be:60 > 33:33:00:00:00:01, ethertype IPv6 (0x86dd), length 86: fe80::1 > ff02::1: HBH ICMP6, multicast listener querymax resp delay: 10000 addr: ::, length 24
03:32:05.931570 20:0c:86:b9:be:60 > d4:1b:81:ac:5b:29, ethertype IPv4 (0x0800), length 66: 52.182.143.210.443 > 192.168.1.28.56024: Flags [.], ack 17445, win 16385, options [nop,nop,TS val 161272276 ecr 139461856], length 0
03:32:05.931570 20:0c:86:b9:be:60 > d4:1b:81:ac:5b:29, ethertype IPv4 (0x0800), length 66: 52.182.143.210.443 > 192.168.1.28.56024: Flags [.], ack 19885, win 16385, options [nop,nop,TS val 161272278 ecr 139461856], length 0
03:32:05.931570 20:0c:86:b9:be:60 > d4:1b:81:ac:5b:29, ethertype IPv4 (0x0800), length 164: 52.182.143.210.443 > 192.168.1.28.56024: Flags [P.], seq 332:430, ack 19885, win 16385, options [nop,nop,TS val 161272279 ecr 139461856], length 98
03:32:05.975030 d4:1b:81:ac:5b:29 > 20:0c:86:b9:be:60, ethertype IPv4 (0x0800), length 66: 192.168.1.28.56024 > 52.182.143.210.443: Flags [.], ack 430, win 564, options [nop,nop,TS val 139462235 ecr 161272279], length 0
03:32:07.111975 8a:75:31:15:cb:3e > d4:1b:81:ac:5b:29, ethertype IPv4 (0x0800), length 82: 192.168.1.10.5353 > 224.0.0.251.5353: 1 PTR (QU)? _kdeconnect._udp.local. (40)
03:32:07.111975 8a:75:31:15:cb:3e > d4:1b:81:ac:5b:29, ethertype IPv6 (0x86dd), length 102: fe80::8875:31ff:fe15:cb3e.5353 > ff02::fb.5353: 1 PTR (QU)? _kdeconnect._udp.local. (40)
03:32:07.254084 d4:1b:81:ac:5b:29 > 20:0c:86:b9:be:60, ethertype IPv4 (0x0800), length 80: 192.168.1.28.31382 > 192.168.1.1.53: 2093+ A? accounts.youtube.com. (38)
03:32:07.254128 d4:1b:81:ac:5b:29 > 20:0c:86:b9:be:60, ethertype IPv4 (0x0800), length 80: 192.168.1.28.7052 > 192.168.1.1.53: 46451+ HTTPS? accounts.youtube.com. (38)
03:32:07.400742 20:0c:86:b9:be:60 > d4:1b:81:ac:5b:29, ethertype IPv4 (0x0800), length 158: 192.168.1.1.53 > 192.168.1.28.7052: 46451 1/1/0 CNAME www3.l.google.com. (116)
03:32:07.552898 8a:75:31:15:cb:3e > d4:1b:81:ac:5b:29, ethertype IPv4 (0x0800), length 279: 192.168.1.10.48876 > 192.168.1.28.1717: Flags [P.], seq 1066:1279, ack 1, win 212, options [nop,nop,TS val 308773340 ecr 3893621070], length 213
03:32:07.552927 d4:1b:81:ac:5b:29 > 8a:75:31:15:cb:3e, ethertype IPv4 (0x0800), length 66: 192.168.1.28.1717 > 192.168.1.10.48876: Flags [.], ack 1279, win 3858, options [nop,nop,TS val 3893623526 ecr 308773340], length 0
03:32:07.689436 d4:1b:81:ac:5b:29 > 20:0c:86:b9:be:60, ethertype IPv4 (0x0800), length 80: 192.168.1.28.7875 > 192.168.1.1.53: 28431+ A? accounts.youtube.com. (38)
03:32:07.793130 20:0c:86:b9:be:60 > d4:1b:81:ac:5b:29, ethertype IPv4 (0x0800), length 240: 192.168.1.1.53 > 192.168.1.28.7875: 28431 2/4/2 CNAME www3.l.google.com., A 142.250.199.142 (198)
03:32:07.793776 d4:1b:81:ac:5b:29 > 20:0c:86:b9:be:60, ethertype IPv4 (0x0800), length 1292: 192.168.1.28.45534 > 142.250.199.142.443: UDP, length 1250
03:32:07.793792 d4:1b:81:ac:5b:29 > 20:0c:86:b9:be:60, ethertype IPv4 (0x0800), length 1292: 192.168.1.28.45534 > 142.250.199.142.443: UDP, length 1250
03:32:07.793922 d4:1b:81:ac:5b:29 > 20:0c:86:b9:be:60, ethertype IPv4 (0x0800), length 118: 192.168.1.28.45534 > 142.250.199.142.443: UDP, length 76
03:32:07.824386 20:0c:86:b9:be:60 > d4:1b:81:ac:5b:29, ethertype IPv4 (0x0800), length 82: 142.250.199.142.443 > 192.168.1.28.45534: UDP, length 40
03:32:07.824386 20:0c:86:b9:be:60 > d4:1b:81:ac:5b:29, ethertype IPv4 (0x0800), length 1292: 142.250.199.142.443 > 192.168.1.28.45534: UDP, length 1250
03:32:07.835028 d4:1b:81:ac:5b:29 > 8a:75:31:15:cb:3e, ethertype ARP (0x0806), length 42: Request who-has 192.168.1.10 tell 192.168.1.28, length 28
03:32:07.855727 d4:1b:81:ac:5b:29 > 20:0c:86:b9:be:60, ethertype IPv4 (0x0800), length 1292: 192.168.1.28.45534 > 142.250.199.142.443: UDP, length 1250
03:32:07.880287 20:0c:86:b9:be:60 > d4:1b:81:ac:5b:29, ethertype IPv4 (0x0800), length 1292: 142.250.199.142.443 > 192.168.1.28.45534: UDP, length 1250
03:32:07.880287 20:0c:86:b9:be:60 > d4:1b:81:ac:5b:29, ethertype IPv4 (0x0800), length 349: 142.250.199.142.443 > 192.168.1.28.45534: UDP, length 307
03:32:07.880287 20:0c:86:b9:be:60 > d4:1b:81:ac:5b:29, ethertype IPv4 (0x0800), length 985: 142.250.199.142.443 > 192.168.1.28.45534: UDP, length 943
03:32:07.880287 20:0c:86:b9:be:60 > d4:1b:81:ac:5b:29, ethertype IPv4 (0x0800), length 76: 142.250.199.142.443 > 192.168.1.28.45534: UDP, length 34
03:32:07.880287 20:0c:86:b9:be:60 > d4:1b:81:ac:5b:29, ethertype IPv4 (0x0800), length 66: 142.250.199.142.443 > 192.168.1.28.45534: UDP, length 24
03:32:07.880287 20:0c:86:b9:be:60 > d4:1b:81:ac:5b:29, ethertype IPv4 (0x0800), length 1292: 142.250.199.142.443 > 192.168.1.28.45534: UDP, length 1250
03:32:07.880663 d4:1b:81:ac:5b:29 > 20:0c:86:b9:be:60, ethertype IPv4 (0x0800), length 120: 192.168.1.28.45534 > 142.250.199.142.443: UDP, length 78
03:32:07.880700 d4:1b:81:ac:5b:29 > 20:0c:86:b9:be:60, ethertype IPv4 (0x0800), length 73: 192.168.1.28.45534 > 142.250.199.142.443: UDP, length 31
03:32:07.880868 d4:1b:81:ac:5b:29 > 20:0c:86:b9:be:60, ethertype IPv4 (0x0800), length 1288: 192.168.1.28.45534 > 142.250.199.142.443: UDP, length 1246
03:32:07.880874 d4:1b:81:ac:5b:29 > 20:0c:86:b9:be:60, ethertype IPv4 (0x0800), length 1148: 192.168.1.28.45534 > 142.250.199.142.443: UDP, length 1106
03:32:07.906123 20:0c:86:b9:be:60 > d4:1b:81:ac:5b:29, ethertype IPv4 (0x0800), length 162: 142.250.199.142.443 > 192.168.1.28.45534: UDP, length 120
03:32:07.906273 d4:1b:81:ac:5b:29 > 20:0c:86:b9:be:60, ethertype IPv4 (0x0800), length 76: 192.168.1.28.45534 > 142.250.199.142.443: UDP, length 34
03:32:07.906810 20:0c:86:b9:be:60 > d4:1b:81:ac:5b:29, ethertype IPv4 (0x0800), length 67: 142.250.199.142.443 > 192.168.1.28.45534: UDP, length 25
03:32:07.906810 20:0c:86:b9:be:60 > d4:1b:81:ac:5b:29, ethertype IPv4 (0x0800), length 71: 142.250.199.142.443 > 192.168.1.28.45534: UDP, length 29
03:32:07.906887 d4:1b:81:ac:5b:29 > 20:0c:86:b9:be:60, ethertype IPv4 (0x0800), length 75: 192.168.1.28.45534 > 142.250.199.142.443: UDP, length 33
03:32:08.012019 8a:75:31:15:cb:3e > d4:1b:81:ac:5b:29, ethertype IPv4 (0x0800), length 82: 192.168.1.10.5353 > 224.0.0.251.5353: 2 PTR (QM)? _kdeconnect._udp.local. (40)
03:32:08.012019 8a:75:31:15:cb:3e > d4:1b:81:ac:5b:29, ethertype IPv6 (0x86dd), length 102: fe80::8875:31ff:fe15:cb3e.5353 > ff02::fb.5353: 2 PTR (QM)? _kdeconnect._udp.local. (40)
03:32:08.013748 8a:75:31:15:cb:3e > d4:1b:81:ac:5b:29, ethertype ARP (0x0806), length 42: Reply 192.168.1.10 is-at 8a:75:31:15:cb:3e, length 28
03:32:08.055505 20:0c:86:b9:be:60 > d4:1b:81:ac:5b:29, ethertype IPv4 (0x0800), length 1288: 142.250.199.142.443 > 192.168.1.28.45534: UDP, length 1246
03:32:08.055506 20:0c:86:b9:be:60 > d4:1b:81:ac:5b:29, ethertype IPv4 (0x0800), length 385: 142.250.199.142.443 > 192.168.1.28.45534: UDP, length 343
03:32:08.055506 20:0c:86:b9:be:60 > d4:1b:81:ac:5b:29, ethertype IPv4 (0x0800), length 76: 142.250.199.142.443 > 192.168.1.28.45534: UDP, length 34
03:32:08.055506 20:0c:86:b9:be:60 > d4:1b:81:ac:5b:29, ethertype IPv4 (0x0800), length 82: 142.250.199.142.443 > 192.168.1.28.45534: UDP, length 40
03:32:08.055679 d4:1b:81:ac:5b:29 > 20:0c:86:b9:be:60, ethertype IPv4 (0x0800), length 75: 192.168.1.28.45534 > 142.250.199.142.443: UDP, length 33
03:32:08.055768 d4:1b:81:ac:5b:29 > 20:0c:86:b9:be:60, ethertype IPv4 (0x0800), length 79: 192.168.1.28.45534 > 142.250.199.142.443: UDP, length 37
03:32:08.081984 d4:1b:81:ac:5b:29 > 20:0c:86:b9:be:60, ethertype IPv4 (0x0800), length 76: 192.168.1.28.45534 > 142.250.199.142.443: UDP, length 34
03:32:08.107045 20:0c:86:b9:be:60 > d4:1b:81:ac:5b:29, ethertype IPv4 (0x0800), length 66: 142.250.199.142.443 > 192.168.1.28.45534: UDP, length 24
03:32:08.113720 20:0c:86:b9:be:60 > d4:1b:81:ac:5b:29, ethertype IPv4 (0x0800), length 64: 142.250.199.142.443 > 192.168.1.28.45534: UDP, length 22
03:32:08.113870 d4:1b:81:ac:5b:29 > 20:0c:86:b9:be:60, ethertype IPv4 (0x0800), length 75: 192.168.1.28.45534 > 142.250.199.142.443: UDP, length 33
03:32:08.159517 8a:75:31:15:cb:3e > d4:1b:81:ac:5b:29, ethertype IPv4 (0x0800), length 365: 192.168.1.10.5353 > 224.0.0.251.5353: 0*- [0q] 1/0/6 PTR 44db6837_b615_4d13_b1ad_e79f1e95e4e3._kdeconnect._udp.local. (323)
03:32:08.347056 d4:1b:81:ac:5b:29 > 33:33:ff:51:11:3b, ethertype IPv6 (0x86dd), length 86: fe80::3634:200d:8451:113b > ff02::1:ff51:113b: HBH ICMP6, multicast listener reportmax resp delay: 0 addr: ff02::1:ff51:113b, length 24
03:32:08.671298 d4:1b:81:ac:5b:29 > 20:0c:86:b9:be:60, ethertype IPv4 (0x0800), length 182: 192.168.1.28.56024 > 52.182.143.210.443: Flags [P.], seq 19885:20001, ack 430, win 564, options [nop,nop,TS val 139464931 ecr 161272279], length 116
03:32:08.673906 d4:1b:81:ac:5b:29 > 20:0c:86:b9:be:60, ethertype IPv4 (0x0800), length 1494: 192.168.1.28.56024 > 52.182.143.210.443: Flags [.], seq 20001:21429, ack 430, win 564, options [nop,nop,TS val 139464934 ecr 161272279], length 1428
03:32:08.673908 d4:1b:81:ac:5b:29 > 20:0c:86:b9:be:60, ethertype IPv4 (0x0800), length 1494: 192.168.1.28.56024 > 52.182.143.210.443: Flags [P.], seq 21429:22857, ack 430, win 564, options [nop,nop,TS val 139464934 ecr 161272279], length 1428
03:32:08.676371 d4:1b:81:ac:5b:29 > 20:0c:86:b9:be:60, ethertype IPv4 (0x0800), length 1078: 192.168.1.28.56024 > 52.182.143.210.443: Flags [P.], seq 22857:23869, ack 430, win 564, options [nop,nop,TS val 139464936 ecr 161272279], length 1012
03:32:09.048590 20:0c:86:b9:be:60 > d4:1b:81:ac:5b:29, ethertype IPv4 (0x0800), length 66: 52.182.143.210.443 > 192.168.1.28.56024: Flags [.], ack 21429, win 16385, options [nop,nop,TS val 161275355 ecr 139464931], length 0
03:32:09.048590 20:0c:86:b9:be:60 > d4:1b:81:ac:5b:29, ethertype IPv4 (0x0800), length 66: 52.182.143.210.443 > 192.168.1.28.56024: Flags [.], ack 23869, win 16385, options [nop,nop,TS val 161275356 ecr 139464934], length 0
03:32:09.048590 20:0c:86:b9:be:60 > d4:1b:81:ac:5b:29, ethertype IPv4 (0x0800), length 164: 52.182.143.210.443 > 192.168.1.28.56024: Flags [P.], seq 430:528, ack 23869, win 16385, options [nop,nop,TS val 161275356 ecr 139464934], length 98
03:32:09.048629 d4:1b:81:ac:5b:29 > 20:0c:86:b9:be:60, ethertype IPv4 (0x0800), length 66: 192.168.1.28.56024 > 52.182.143.210.443: Flags [.], ack 528, win 564, options [nop,nop,TS val 139465308 ecr 161275356], length 0
03:32:09.049496 d4:1b:81:ac:5b:29 > 20:0c:86:b9:be:60, ethertype IPv4 (0x0800), length 101: 192.168.1.28.56024 > 52.182.143.210.443: Flags [P.], seq 23869:23904, ack 528, win 564, options [nop,nop,TS val 139465309 ecr 161275356], length 35
03:32:09.056770 8a:75:31:15:cb:3e > d4:1b:81:ac:5b:29, ethertype IPv4 (0x0800), length 82: 192.168.1.10.5353 > 224.0.0.251.5353: 3 PTR (QM)? _kdeconnect._udp.local. (40)
03:32:09.056770 8a:75:31:15:cb:3e > d4:1b:81:ac:5b:29, ethertype IPv6 (0x86dd), length 102: fe80::8875:31ff:fe15:cb3e.5353 > ff02::fb.5353: 3 PTR (QM)? _kdeconnect._udp.local. (40)
03:32:09.302382 8a:75:31:15:cb:3e > d4:1b:81:ac:5b:29, ethertype IPv6 (0x86dd), length 385: fe80::8875:31ff:fe15:cb3e.5353 > ff02::fb.5353: 0*- [0q] 1/0/6 PTR 44db6837_b615_4d13_b1ad_e79f1e95e4e3._kdeconnect._udp.local. (323)
03:32:09.342462 20:0c:86:b9:be:60 > d4:1b:81:ac:5b:29, ethertype IPv4 (0x0800), length 66: 52.182.143.210.443 > 192.168.1.28.56024: Flags [.], ack 23904, win 16385, options [nop,nop,TS val 161275784 ecr 139465309], length 0
03:32:10.225671 22:85:56:cf:b3:af > 33:33:ff:cf:b3:af, ethertype IPv6 (0x86dd), length 86: fe80::2085:56ff:fecf:b3af > ff02::1:ffcf:b3af: HBH ICMP6, multicast listener reportmax resp delay: 0 addr: ff02::1:ffcf:b3af, length 24
03:32:10.430023 8a:75:31:15:cb:3e > d4:1b:81:ac:5b:29, ethertype IPv4 (0x0800), length 279: 192.168.1.10.48876 > 192.168.1.28.1717: Flags [P.], seq 1279:1492, ack 1, win 212, options [nop,nop,TS val 308775939 ecr 3893623526], length 213
03:32:10.430024 8a:75:31:15:cb:3e > d4:1b:81:ac:5b:29, ethertype IPv4 (0x0800), length 279: 192.168.1.10.48876 > 192.168.1.28.1717: Flags [P.], seq 1279:1492, ack 1, win 212, options [nop,nop,TS val 308776162 ecr 3893623526], length 213
03:32:10.430058 d4:1b:81:ac:5b:29 > 8a:75:31:15:cb:3e, ethertype IPv4 (0x0800), length 66: 192.168.1.28.1717 > 192.168.1.10.48876: Flags [.], ack 1492, win 3857, options [nop,nop,TS val 3893626403 ecr 308775939], length 0
03:32:10.430074 d4:1b:81:ac:5b:29 > 8a:75:31:15:cb:3e, ethertype IPv4 (0x0800), length 78: 192.168.1.28.1717 > 192.168.1.10.48876: Flags [.], ack 1492, win 3857, options [nop,nop,TS val 3893626403 ecr 308776162,nop,nop,sack 1 {1279:1492}], length 0
03:32:10.718290 d4:1b:81:ac:5b:29 > 20:0c:86:b9:be:60, ethertype IPv4 (0x0800), length 183: 192.168.1.28.56024 > 52.182.143.210.443: Flags [P.], seq 23904:24021, ack 528, win 564, options [nop,nop,TS val 139466978 ecr 161275784], length 117
03:32:10.718336 d4:1b:81:ac:5b:29 > 20:0c:86:b9:be:60, ethertype IPv4 (0x0800), length 1494: 192.168.1.28.56024 > 52.182.143.210.443: Flags [.], seq 24021:25449, ack 528, win 564, options [nop,nop,TS val 139466978 ecr 161275784], length 1428
03:32:10.718338 d4:1b:81:ac:5b:29 > 20:0c:86:b9:be:60, ethertype IPv4 (0x0800), length 1494: 192.168.1.28.56024 > 52.182.143.210.443: Flags [P.], seq 25449:26877, ack 528, win 564, options [nop,nop,TS val 139466978 ecr 161275784], length 1428
03:32:10.721740 d4:1b:81:ac:5b:29 > 20:0c:86:b9:be:60, ethertype IPv4 (0x0800), length 1494: 192.168.1.28.56024 > 52.182.143.210.443: Flags [.], seq 26877:28305, ack 528, win 564, options [nop,nop,TS val 139466981 ecr 161275784], length 1428
03:32:10.721750 d4:1b:81:ac:5b:29 > 20:0c:86:b9:be:60, ethertype IPv4 (0x0800), length 1494: 192.168.1.28.56024 > 52.182.143.210.443: Flags [P.], seq 28305:29733, ack 528, win 564, options [nop,nop,TS val 139466981 ecr 161275784], length 1428
03:32:10.724207 d4:1b:81:ac:5b:29 > 20:0c:86:b9:be:60, ethertype IPv4 (0x0800), length 1494: 192.168.1.28.56024 > 52.182.143.210.443: Flags [.], seq 29733:31161, ack 528, win 564, options [nop,nop,TS val 139466984 ecr 161275784], length 1428
03:32:10.724217 d4:1b:81:ac:5b:29 > 20:0c:86:b9:be:60, ethertype IPv4 (0x0800), length 632: 192.168.1.28.56024 > 52.182.143.210.443: Flags [P.], seq 31161:31727, ack 528, win 564, options [nop,nop,TS val 139466984 ecr 161275784], length 566
03:32:11.005535 20:0c:86:b9:be:60 > d4:1b:81:ac:5b:29, ethertype IPv4 (0x0800), length 66: 52.182.143.210.443 > 192.168.1.28.56024: Flags [.], ack 25449, win 16385, options [nop,nop,TS val 161277400 ecr 139466978], length 0
03:32:11.005535 20:0c:86:b9:be:60 > d4:1b:81:ac:5b:29, ethertype IPv4 (0x0800), length 66: 52.182.143.210.443 > 192.168.1.28.56024: Flags [.], ack 29733, win 16385, options [nop,nop,TS val 161277404 ecr 139466978], length 0
03:32:11.005535 20:0c:86:b9:be:60 > d4:1b:81:ac:5b:29, ethertype IPv4 (0x0800), length 66: 52.182.143.210.443 > 192.168.1.28.56024: Flags [.], ack 31161, win 16380, options [nop,nop,TS val 161277404 ecr 139466984], length 0
03:32:11.014297 20:0c:86:b9:be:60 > d4:1b:81:ac:5b:29, ethertype IPv4 (0x0800), length 66: 52.182.143.210.443 > 192.168.1.28.56024: Flags [.], ack 31727, win 16385, options [nop,nop,TS val 161277456 ecr 139466984], length 0
03:32:11.452616 20:0c:86:b9:be:60 > d4:1b:81:ac:5b:29, ethertype IPv4 (0x0800), length 165: 52.182.143.210.443 > 192.168.1.28.56024: Flags [P.], seq 528:627, ack 31727, win 16385, options [nop,nop,TS val 161277681 ecr 139466984], length 99
03:32:11.495047 d4:1b:81:ac:5b:29 > 20:0c:86:b9:be:60, ethertype IPv4 (0x0800), length 66: 192.168.1.28.56024 > 52.182.143.210.443: Flags [.], ack 627, win 564, options [nop,nop,TS val 139467755 ecr 161277681], length 0
03:32:11.965944 8a:75:31:15:cb:3e > 01:00:5e:00:00:fb, ethertype IPv4 (0x0800), length 46: 192.168.1.10 > 224.0.0.251: igmp v2 report 224.0.0.251
03:32:11.966698 8a:75:31:15:cb:3e > 01:00:5e:00:00:fb, ethertype IPv4 (0x0800), length 46: 192.168.1.10 > 224.0.0.251: igmp v2 report 224.0.0.251
03:32:12.066570 22:85:56:cf:b3:af > 33:33:ff:00:00:00, ethertype IPv6 (0x86dd), length 86: fe80::2085:56ff:fecf:b3af > ff02::1:ff00:0: HBH ICMP6, multicast listener reportmax resp delay: 0 addr: ff02::1:ff00:0, length 24
03:32:12.067762 22:85:56:cf:b3:af > 33:33:ff:00:00:00, ethertype IPv6 (0x86dd), length 86: fe80::2085:56ff:fecf:b3af > ff02::1:ff00:0: HBH ICMP6, multicast listener reportmax resp delay: 0 addr: ff02::1:ff00:0, length 24
03:32:12.071826 22:85:56:cf:b3:af > 33:33:ff:00:00:00, ethertype IPv6 (0x86dd), length 86: fe80::2085:56ff:fecf:b3af > ff02::1:ff00:0: HBH ICMP6, multicast listener reportmax resp delay: 0 addr: ff02::1:ff00:0, length 24
03:32:12.073317 8a:75:31:15:cb:3e > 33:33:00:00:00:02, ethertype IPv6 (0x86dd), length 86: fe80::8875:31ff:fe15:cb3e > ff02::2: HBH ICMP6, multicast listener reportmax resp delay: 0 addr: ff02::2, length 24
03:32:12.652193 8a:75:31:15:cb:3e > d4:1b:81:ac:5b:29, ethertype ARP (0x0806), length 42: Request who-has 192.168.1.28 tell 192.168.1.10, length 28
03:32:12.652204 d4:1b:81:ac:5b:29 > 8a:75:31:15:cb:3e, ethertype ARP (0x0806), length 42: Reply 192.168.1.28 is-at d4:1b:81:ac:5b:29, length 28
03:32:13.194429 8a:75:31:15:cb:3e > 33:33:00:00:00:02, ethertype IPv6 (0x86dd), length 86: fe80::8875:31ff:fe15:cb3e > ff05::2: HBH ICMP6, multicast listener reportmax resp delay: 0 addr: ff05::2, length 24
03:32:13.195610 8a:75:31:15:cb:3e > 33:33:00:00:00:02, ethertype IPv6 (0x86dd), length 86: fe80::8875:31ff:fe15:cb3e > ff05::2: HBH ICMP6, multicast listener reportmax resp delay: 0 addr: ff05::2, length 24
03:32:13.723074 d4:1b:81:ac:5b:29 > 33:33:00:00:00:fb, ethertype IPv6 (0x86dd), length 86: fe80::3634:200d:8451:113b > ff02::fb: HBH ICMP6, multicast listener reportmax resp delay: 0 addr: ff02::fb, length 24
03:32:13.791580 d4:1b:81:ac:5b:29 > 20:0c:86:b9:be:60, ethertype IPv4 (0x0800), length 184: 192.168.1.28.56024 > 52.182.143.210.443: Flags [P.], seq 31727:31845, ack 627, win 564, options [nop,nop,TS val 139470051 ecr 161277681], length 118
03:32:13.791720 d4:1b:81:ac:5b:29 > 20:0c:86:b9:be:60, ethertype IPv4 (0x0800), length 1494: 192.168.1.28.56024 > 52.182.143.210.443: Flags [.], seq 31845:33273, ack 627, win 564, options [nop,nop,TS val 139470051 ecr 161277681], length 1428
