03:44:56.875546 d4:1b:81:ac:5b:29 > 20:0c:86:b9:be:60, ethertype IPv4 (0x0800), length 184: 192.168.1.28.40206 > 13.89.179.14.443: Flags [P.], seq 2407527038:2407527156, ack 3263431178, win 501, options [nop,nop,TS val 4225475730 ecr 991988641], length 118
03:44:56.875604 d4:1b:81:ac:5b:29 > 20:0c:86:b9:be:60, ethertype IPv4 (0x0800), length 1494: 192.168.1.28.40206 > 13.89.179.14.443: Flags [.], seq 118:1546, ack 1, win 501, options [nop,nop,TS val 4225475730 ecr 991988641], length 1428
03:44:56.875606 d4:1b:81:ac:5b:29 > 20:0c:86:b9:be:60, ethertype IPv4 (0x0800), length 1494: 192.168.1.28.40206 > 13.89.179.14.443: Flags [P.], seq 1546:2974, ack 1, win 501, options [nop,nop,TS val 4225475730 ecr 991988641], length 1428
03:44:56.878050 d4:1b:81:ac:5b:29 > 20:0c:86:b9:be:60, ethertype IPv4 (0x0800), length 1494: 192.168.1.28.40206 > 13.89.179.14.443: Flags [.], seq 2974:4402, ack 1, win 501, options [nop,nop,TS val 4225475733 ecr 991988641], length 1428
03:44:56.878061 d4:1b:81:ac:5b:29 > 20:0c:86:b9:be:60, ethertype IPv4 (0x0800), length 1494: 192.168.1.28.40206 > 13.89.179.14.443: Flags [P.], seq 4402:5830, ack 1, win 501, options [nop,nop,TS val 4225475733 ecr 991988641], length 1428
03:44:56.879785 d4:1b:81:ac:5b:29 > 20:0c:86:b9:be:60, ethertype IPv4 (0x0800), length 199: 192.168.1.28.40206 > 13.89.179.14.443: Flags [P.], seq 5830:5963, ack 1, win 501, options [nop,nop,TS val 4225475734 ecr 991988641], length 133
03:44:57.187929 20:0c:86:b9:be:60 > d4:1b:81:ac:5b:29, ethertype IPv4 (0x0800), length 66: 13.89.179.14.443 > 192.168.1.28.40206: Flags [.], ack 1546, win 16385, options [nop,nop,TS val 992017430 ecr 4225475730], length 0
03:44:57.187929 20:0c:86:b9:be:60 > d4:1b:81:ac:5b:29, ethertype IPv4 (0x0800), length 66: 13.89.179.14.443 > 192.168.1.28.40206: Flags [.], ack 5830, win 16385, options [nop,nop,TS val 992017431 ecr 4225475730], length 0
03:44:57.187929 20:0c:86:b9:be:60 > d4:1b:81:ac:5b:29, ethertype IPv4 (0x0800), length 66: 13.89.179.14.443 > 192.168.1.28.40206: Flags [.], ack 5963, win 16385, options [nop,nop,TS val 992017432 ecr 4225475734], length 0
03:44:57.187929 20:0c:86:b9:be:60 > d4:1b:81:ac:5b:29, ethertype IPv4 (0x0800), length 105: 13.89.179.14.443 > 192.168.1.28.40206: Flags [P.], seq 1:40, ack 5963, win 16385, options [nop,nop,TS val 992017442 ecr 4225475734], length 39
03:44:57.230987 d4:1b:81:ac:5b:29 > 20:0c:86:b9:be:60, ethertype IPv4 (0x0800), length 66: 192.168.1.28.40206 > 13.89.179.14.443: Flags [.], ack 40, win 501, options [nop,nop,TS val 4225476086 ecr 992017442], length 0
03:44:57.370944 d4:1b:81:ac:5b:29 > 8a:75:31:15:cb:3e, ethertype IPv4 (0x0800), length 66: 192.168.1.28.1717 > 192.168.1.10.48876: Flags [.], ack 146596668, win 3864, options [nop,nop,TS val 3894393344 ecr 309229988], length 0
03:44:57.433458 8a:75:31:15:cb:3e > d4:1b:81:ac:5b:29, ethertype IPv4 (0x0800), length 66: 192.168.1.10.48876 > 192.168.1.28.1717: Flags [.], ack 1, win 235, options [nop,nop,TS val 309230667 ecr 3894377998], length 0
03:44:57.470042 20:0c:86:b9:be:60 > d4:1b:81:ac:5b:29, ethertype IPv4 (0x0800), length 164: 13.89.179.14.443 > 192.168.1.28.40206: Flags [P.], seq 40:138, ack 5963, win 16385, options [nop,nop,TS val 992017784 ecr 4225476086], length 98
03:44:57.470070 d4:1b:81:ac:5b:29 > 20:0c:86:b9:be:60, ethertype IPv4 (0x0800), length 66: 192.168.1.28.40206 > 13.89.179.14.443: Flags [.], ack 138, win 501, options [nop,nop,TS val 4225476325 ecr 992017784], length 0
03:44:57.471033 d4:1b:81:ac:5b:29 > 20:0c:86:b9:be:60, ethertype IPv4 (0x0800), length 101: 192.168.1.28.40206 > 13.89.179.14.443: Flags [P.], seq 5963:5998, ack 138, win 501, options [nop,nop,TS val 4225476326 ecr 992017784], length 35
03:44:57.803947 20:0c:86:b9:be:60 > d4:1b:81:ac:5b:29, ethertype IPv4 (0x0800), length 66: 13.89.179.14.443 > 192.168.1.28.40206: Flags [.], ack 5998, win 16384, options [nop,nop,TS val 992018065 ecr 4225476326], length 0
03:45:00.715055 d4:1b:81:ac:5b:29 > 20:0c:86:b9:be:60, ethertype IPv4 (0x0800), length 66: 192.168.1.28.54960 > 74.125.68.188.5228: Flags [.], ack 3723117196, win 533, options [nop,nop,TS val 233899208 ecr 1275680209], length 0
03:45:00.785500 20:0c:86:b9:be:60 > d4:1b:81:ac:5b:29, ethertype IPv4 (0x0800), length 66: 74.125.68.188.5228 > 192.168.1.28.54960: Flags [.], ack 1, win 1043, options [nop,nop,TS val 1275725281 ecr 233217192], length 0
03:45:03.005436 d4:1b:81:ac:5b:29 > 20:0c:86:b9:be:60, ethertype IPv4 (0x0800), length 183: 192.168.1.28.40206 > 13.89.179.14.443: Flags [P.], seq 5998:6115, ack 138, win 501, options [nop,nop,TS val 4225481860 ecr 992018065], length 117
03:45:03.008097 d4:1b:81:ac:5b:29 > 20:0c:86:b9:be:60, ethertype IPv4 (0x0800), length 1494: 192.168.1.28.40206 > 13.89.179.14.443: Flags [.], seq 6115:7543, ack 138, win 501, options [nop,nop,TS val 4225481863 ecr 992018065], length 1428
03:45:03.008099 d4:1b:81:ac:5b:29 > 20:0c:86:b9:be:60, ethertype IPv4 (0x0800), length 594: 192.168.1.28.40206 > 13.89.179.14.443: Flags [P.], seq 7543:8071, ack 138, win 501, options [nop,nop,TS val 4225481863 ecr 992018065], length 528
03:45:03.331387 20:0c:86:b9:be:60 > d4:1b:81:ac:5b:29, ethertype IPv4 (0x0800), length 66: 13.89.179.14.443 > 192.168.1.28.40206: Flags [.], ack 7543, win 16385, options [nop,nop,TS val 992023561 ecr 4225481860], length 0
03:45:03.332143 20:0c:86:b9:be:60 > d4:1b:81:ac:5b:29, ethertype IPv4 (0x0800), length 66: 13.89.179.14.443 > 192.168.1.28.40206: Flags [.], ack 8071, win 16383, options [nop,nop,TS val 992023612 ecr 4225481863], length 0
03:45:04.356028 20:0c:86:b9:be:60 > d4:1b:81:ac:5b:29, ethertype IPv4 (0x0800), length 165: 13.89.179.14.443 > 192.168.1.28.40206: Flags [P.], seq 138:237, ack 8071, win 16383, options [nop,nop,TS val 992024591 ecr 4225481863], length 99
03:45:04.356926 d4:1b:81:ac:5b:29 > 20:0c:86:b9:be:60, ethertype IPv4 (0x0800), length 101: 192.168.1.28.40206 > 13.89.179.14.443: Flags [P.], seq 8071:8106, ack 237, win 501, options [nop,nop,TS val 4225483212 ecr 992024591], length 35
03:45:04.765098 20:0c:86:b9:be:60 > d4:1b:81:ac:5b:29, ethertype IPv4 (0x0800), length 66: 13.89.179.14.443 > 192.168.1.28.40206: Flags [.], ack 8106, win 16383, options [nop,nop,TS val 992025018 ecr 4225483212], length 0
03:45:05.287689 d4:1b:81:ac:5b:29 > 20:0c:86:b9:be:60, ethertype IPv4 (0x0800), length 74: 192.168.1.28.57440 > 13.107.246.68.443: Flags [S], seq 386535049, win 64240, options [mss 1460,sackOK,TS val 82407997 ecr 0,nop,wscale 7], length 0
03:45:05.291989 20:0c:86:b9:be:60 > d4:1b:81:ac:5b:29, ethertype IPv4 (0x0800), length 74: 13.107.246.68.443 > 192.168.1.28.57440: Flags [S.], seq 2272985354, ack 386535050, win 43338, options [mss 1410,sackOK,TS val 3285704677 ecr 82407997,nop,wscale 9], length 0
03:45:05.292022 d4:1b:81:ac:5b:29 > 20:0c:86:b9:be:60, ethertype IPv4 (0x0800), length 66: 192.168.1.28.57440 > 13.107.246.68.443: Flags [.], ack 1, win 502, options [nop,nop,TS val 82408002 ecr 3285704677], length 0
03:45:05.292550 d4:1b:81:ac:5b:29 > 20:0c:86:b9:be:60, ethertype IPv4 (0x0800), length 1464: 192.168.1.28.57440 > 13.107.246.68.443: Flags [.], seq 1:1399, ack 1, win 502, options [nop,nop,TS val 82408002 ecr 3285704677], length 1398
03:45:05.292556 d4:1b:81:ac:5b:29 > 20:0c:86:b9:be:60, ethertype IPv4 (0x0800), length 796: 192.168.1.28.57440 > 13.107.246.68.443: Flags [P.], seq 1399:2129, ack 1, win 502, options [nop,nop,TS val 82408002 ecr 3285704677], length 730
03:45:05.296838 20:0c:86:b9:be:60 > d4:1b:81:ac:5b:29, ethertype IPv4 (0x0800), length 66: 13.107.246.68.443 > 192.168.1.28.57440: Flags [.], ack 2129, win 83, options [nop,nop,TS val 3285704682 ecr 82408002], length 0
03:45:05.297553 20:0c:86:b9:be:60 > d4:1b:81:ac:5b:29, ethertype IPv4 (0x0800), length 165: 13.107.246.68.443 > 192.168.1.28.57440: Flags [P.], seq 1:100, ack 2129, win 83, options [nop,nop,TS val 3285704683 ecr 82408002], length 99
03:45:05.297580 d4:1b:81:ac:5b:29 > 20:0c:86:b9:be:60, ethertype IPv4 (0x0800), length 66: 192.168.1.28.57440 > 13.107.246.68.443: Flags [.], ack 100, win 502, options [nop,nop,TS val 82408007 ecr 3285704683], length 0
03:45:05.297842 d4:1b:81:ac:5b:29 > 20:0c:86:b9:be:60, ethertype IPv4 (0x0800), length 1008: 192.168.1.28.57440 > 13.107.246.68.443: Flags [P.], seq 2129:3071, ack 100, win 502, options [nop,nop,TS val 82408007 ecr 3285704683], length 942
03:45:05.303572 20:0c:86:b9:be:60 > d4:1b:81:ac:5b:29, ethertype IPv4 (0x0800), length 347: 13.107.246.68.443 > 192.168.1.28.57440: Flags [P.], seq 100:381, ack 3071, win 83, options [nop,nop,TS val 3285704689 ecr 82408007], length 281
03:45:05.303912 d4:1b:81:ac:5b:29 > 20:0c:86:b9:be:60, ethertype IPv4 (0x0800), length 140: 192.168.1.28.57440 > 13.107.246.68.443: Flags [P.], seq 3071:3145, ack 381, win 501, options [nop,nop,TS val 82408014 ecr 3285704689], length 74
03:45:05.304008 d4:1b:81:ac:5b:29 > 20:0c:86:b9:be:60, ethertype IPv4 (0x0800), length 158: 192.168.1.28.57440 > 13.107.246.68.443: Flags [P.], seq 3145:3237, ack 381, win 501, options [nop,nop,TS val 82408014 ecr 3285704689], length 92
03:45:05.305701 d4:1b:81:ac:5b:29 > 20:0c:86:b9:be:60, ethertype IPv4 (0x0800), length 331: 192.168.1.28.57440 > 13.107.246.68.443: Flags [P.], seq 3237:3502, ack 381, win 501, options [nop,nop,TS val 82408015 ecr 3285704689], length 265
03:45:05.307786 20:0c:86:b9:be:60 > d4:1b:81:ac:5b:29, ethertype IPv4 (0x0800), length 66: 13.107.246.68.443 > 192.168.1.28.57440: Flags [.], ack 3237, win 83, options [nop,nop,TS val 3285704693 ecr 82408014], length 0
03:45:05.308068 20:0c:86:b9:be:60 > d4:1b:81:ac:5b:29, ethertype IPv4 (0x0800), length 137: 13.107.246.68.443 > 192.168.1.28.57440: Flags [P.], seq 381:452, ack 3237, win 83, options [nop,nop,TS val 3285704693 ecr 82408014], length 71
03:45:05.308741 d4:1b:81:ac:5b:29 > 20:0c:86:b9:be:60, ethertype IPv4 (0x0800), length 97: 192.168.1.28.57440 > 13.107.246.68.443: Flags [P.], seq 3502:3533, ack 452, win 501, options [nop,nop,TS val 82408018 ecr 3285704693], length 31
03:45:05.317486 20:0c:86:b9:be:60 > d4:1b:81:ac:5b:29, ethertype IPv4 (0x0800), length 1464: 13.107.246.68.443 > 192.168.1.28.57440: Flags [.], seq 452:1850, ack 3502, win 83, options [nop,nop,TS val 3285704698 ecr 82408015], length 1398
03:45:05.319808 20:0c:86:b9:be:60 > d4:1b:81:ac:5b:29, ethertype IPv4 (0x0800), length 4260: 13.107.246.68.443 > 192.168.1.28.57440: Flags [P.], seq 1850:6044, ack 3502, win 83, options [nop,nop,TS val 3285704698 ecr 82408015], length 4194
03:45:05.319808 20:0c:86:b9:be:60 > d4:1b:81:ac:5b:29, ethertype IPv4 (0x0800), length 5658: 13.107.246.68.443 > 192.168.1.28.57440: Flags [P.], seq 6044:11636, ack 3502, win 83, options [nop,nop,TS val 3285704698 ecr 82408015], length 5592
03:45:05.319808 20:0c:86:b9:be:60 > d4:1b:81:ac:5b:29, ethertype IPv4 (0x0800), length 1464: 13.107.246.68.443 > 192.168.1.28.57440: Flags [.], seq 11636:13034, ack 3502, win 83, options [nop,nop,TS val 3285704699 ecr 82408015], length 1398
03:45:05.319843 20:0c:86:b9:be:60 > d4:1b:81:ac:5b:29, ethertype IPv4 (0x0800), length 2862: 13.107.246.68.443 > 192.168.1.28.57440: Flags [P.], seq 13034:15830, ack 3533, win 83, options [nop,nop,TS val 3285704699 ecr 82408018], length 2796
03:45:05.319973 d4:1b:81:ac:5b:29 > 20:0c:86:b9:be:60, ethertype IPv4 (0x0800), length 66: 192.168.1.28.57440 > 13.107.246.68.443: Flags [.], ack 15830, win 510, options [nop,nop,TS val 82408030 ecr 3285704698], length 0
03:45:05.334810 20:0c:86:b9:be:60 > d4:1b:81:ac:5b:29, ethertype IPv4 (0x0800), length 11250: 13.107.246.68.443 > 192.168.1.28.57440: Flags [P.], seq 15830:27014, ack 3533, win 83, options [nop,nop,TS val 3285704709 ecr 82408030], length 11184
03:45:05.334838 20:0c:86:b9:be:60 > d4:1b:81:ac:5b:29, ethertype IPv4 (0x0800), length 2862: 13.107.246.68.443 > 192.168.1.28.57440: Flags [.], seq 27014:29810, ack 3533, win 83, options [nop,nop,TS val 3285704709 ecr 82408030], length 2796
03:45:05.334885 d4:1b:81:ac:5b:29 > 20:0c:86:b9:be:60, ethertype IPv4 (0x0800), length 66: 192.168.1.28.57440 > 13.107.246.68.443: Flags [.], ack 29810, win 510, options [nop,nop,TS val 82408044 ecr 3285704709], length 0
03:45:05.340043 20:0c:86:b9:be:60 > d4:1b:81:ac:5b:29, ethertype IPv4 (0x0800), length 8454: 13.107.246.68.443 > 192.168.1.28.57440: Flags [P.], seq 29810:38198, ack 3533, win 83, options [nop,nop,TS val 3285704709 ecr 82408030], length 8388
03:45:05.340043 20:0c:86:b9:be:60 > d4:1b:81:ac:5b:29, ethertype IPv4 (0x0800), length 4260: 13.107.246.68.443 > 192.168.1.28.57440: Flags [.], seq 38198:42392, ack 3533, win 83, options [nop,nop,TS val 3285704710 ecr 82408030], length 4194
03:45:05.340074 d4:1b:81:ac:5b:29 > 20:0c:86:b9:be:60, ethertype IPv4 (0x0800), length 66: 192.168.1.28.57440 > 13.107.246.68.443: Flags [.], ack 38198, win 641, options [nop,nop,TS val 82408050 ecr 3285704709], length 0
03:45:05.340083 d4:1b:81:ac:5b:29 > 20:0c:86:b9:be:60, ethertype IPv4 (0x0800), length 66: 192.168.1.28.57440 > 13.107.246.68.443: Flags [.], ack 42392, win 706, options [nop,nop,TS val 82408050 ecr 3285704710], length 0
03:45:05.341766 20:0c:86:b9:be:60 > d4:1b:81:ac:5b:29, ethertype IPv4 (0x0800), length 1464: 13.107.246.68.443 > 192.168.1.28.57440: Flags [P.], seq 42392:43790, ack 3533, win 83, options [nop,nop,TS val 3285704710 ecr 82408030], length 1398
03:45:05.341766 20:0c:86:b9:be:60 > d4:1b:81:ac:5b:29, ethertype IPv4 (0x0800), length 2862: 13.107.246.68.443 > 192.168.1.28.57440: Flags [P.], seq 43790:46586, ack 3533, win 83, options [nop,nop,TS val 3285704711 ecr 82408030], length 2796
03:45:05.341777 d4:1b:81:ac:5b:29 > 20:0c:86:b9:be:60, ethertype IPv4 (0x0800), length 66: 192.168.1.28.57440 > 13.107.246.68.443: Flags [.], ack 46586, win 772, options [nop,nop,TS val 82408051 ecr 3285704710], length 0
03:45:05.342857 20:0c:86:b9:be:60 > d4:1b:81:ac:5b:29, ethertype IPv4 (0x0800), length 3120: 13.107.246.68.443 > 192.168.1.28.57440: Flags [P.], seq 46586:49640, ack 3533, win 83, options [nop,nop,TS val 3285704724 ecr 82408044], length 3054
03:45:05.342862 d4:1b:81:ac:5b:29 > 20:0c:86:b9:be:60, ethertype IPv4 (0x0800), length 66: 192.168.1.28.57440 > 13.107.246.68.443: Flags [.], ack 49640, win 820, options [nop,nop,TS val 82408052 ecr 3285704724], length 0
03:45:06.251381 d4:1b:81:ac:5b:29 > 20:0c:86:b9:be:60, ethertype IPv4 (0x0800), length 306: 192.168.1.28.44910 > 35.174.127.31.443: Flags [P.], seq 4271151456:4271151696, ack 2858122143, win 549, options [nop,nop,TS val 1796876461 ecr 1823637861], length 240
03:45:06.506541 20:0c:86:b9:be:60 > d4:1b:81:ac:5b:29, ethertype IPv4 (0x0800), length 329: 35.174.127.31.443 > 192.168.1.28.44910: Flags [P.], seq 1:264, ack 240, win 441, options [nop,nop,TS val 1823653854 ecr 1796876461], length 263
03:45:06.506573 d4:1b:81:ac:5b:29 > 20:0c:86:b9:be:60, ethertype IPv4 (0x0800), length 66: 192.168.1.28.44910 > 35.174.127.31.443: Flags [.], ack 264, win 549, options [nop,nop,TS val 1796876716 ecr 1823653854], length 0
03:45:06.842934 d4:1b:81:ac:5b:29 > 20:0c:86:b9:be:60, ethertype IPv4 (0x0800), length 66: 192.168.1.28.40208 > 13.89.179.14.443: Flags [.], ack 2589137752, win 501, options [nop,nop,TS val 4225485698 ecr 990889952], length 0
03:45:07.122115 20:0c:86:b9:be:60 > d4:1b:81:ac:5b:29, ethertype IPv4 (0x0800), length 66: 13.89.179.14.443 > 192.168.1.28.40208: Flags [.], ack 1, win 16382, options [nop,nop,TS val 990936052 ecr 4225439898], length 0
03:45:07.611054 d4:1b:81:ac:5b:29 > 8a:75:31:15:cb:3e, ethertype IPv4 (0x0800), length 66: 192.168.1.28.1717 > 192.168.1.10.48876: Flags [.], ack 1, win 3864, options [nop,nop,TS val 3894403584 ecr 309230667], length 0
03:45:08.125667 d4:1b:81:ac:5b:29 > 20:0c:86:b9:be:60, ethertype IPv4 (0x0800), length 178: 192.168.1.28.40206 > 13.89.179.14.443: Flags [P.], seq 8106:8218, ack 237, win 501, options [nop,nop,TS val 4225486980 ecr 992025018], length 112
03:45:08.128331 d4:1b:81:ac:5b:29 > 20:0c:86:b9:be:60, ethertype IPv4 (0x0800), length 1494: 192.168.1.28.40206 > 13.89.179.14.443: Flags [.], seq 8218:9646, ack 237, win 501, options [nop,nop,TS val 4225486983 ecr 992025018], length 1428
03:45:08.128334 d4:1b:81:ac:5b:29 > 20:0c:86:b9:be:60, ethertype IPv4 (0x0800), length 594: 192.168.1.28.40206 > 13.89.179.14.443: Flags [P.], seq 9646:10174, ack 237, win 501, options [nop,nop,TS val 4225486983 ecr 992025018], length 528
03:45:08.452599 20:0c:86:b9:be:60 > d4:1b:81:ac:5b:29, ethertype IPv4 (0x0800), length 66: 13.89.179.14.443 > 192.168.1.28.40206: Flags [.], ack 9646, win 16385, options [nop,nop,TS val 992028681 ecr 4225486980], length 0
03:45:08.500620 20:0c:86:b9:be:60 > d4:1b:81:ac:5b:29, ethertype IPv4 (0x0800), length 66: 13.89.179.14.443 > 192.168.1.28.40206: Flags [.], ack 10174, win 16383, options [nop,nop,TS val 992028815 ecr 4225486983], length 0
03:45:08.759223 20:0c:86:b9:be:60 > d4:1b:81:ac:5b:29, ethertype IPv4 (0x0800), length 165: 13.89.179.14.443 > 192.168.1.28.40206: Flags [P.], seq 237:336, ack 10174, win 16383, options [nop,nop,TS val 992028981 ecr 4225486983], length 99
03:45:08.806961 d4:1b:81:ac:5b:29 > 20:0c:86:b9:be:60, ethertype IPv4 (0x0800), length 66: 192.168.1.28.40206 > 13.89.179.14.443: Flags [.], ack 336, win 501, options [nop,nop,TS val 4225487662 ecr 992028981], length 0
03:45:11.198365 d4:1b:81:ac:5b:29 > 20:0c:86:b9:be:60, ethertype IPv4 (0x0800), length 178: 192.168.1.28.40206 > 13.89.179.14.443: Flags [P.], seq 10174:10286, ack 336, win 501, options [nop,nop,TS val 4225490053 ecr 992028981], length 112
03:45:11.198400 d4:1b:81:ac:5b:29 > 20:0c:86:b9:be:60, ethertype IPv4 (0x0800), length 1494: 192.168.1.28.40206 > 13.89.179.14.443: Flags [.], seq 10286:11714, ack 336, win 501, options [nop,nop,TS val 4225490053 ecr 992028981], length 1428
03:45:11.198402 d4:1b:81:ac:5b:29 > 20:0c:86:b9:be:60, ethertype IPv4 (0x0800), length 594: 192.168.1.28.40206 > 13.89.179.14.443: Flags [P.], seq 11714:12242, ack 336, win 501, options [nop,nop,TS val 4225490053 ecr 992028981], length 528
03:45:11.523567 20:0c:86:b9:be:60 > d4:1b:81:ac:5b:29, ethertype IPv4 (0x0800), length 66: 13.89.179.14.443 > 192.168.1.28.40206: Flags [.], ack 11714, win 16385, options [nop,nop,TS val 992031752 ecr 4225490053], length 0
03:45:11.523815 20:0c:86:b9:be:60 > d4:1b:81:ac:5b:29, ethertype IPv4 (0x0800), length 66: 13.89.179.14.443 > 192.168.1.28.40206: Flags [.], ack 12242, win 16383, options [nop,nop,TS val 992031815 ecr 4225490053], length 0
03:45:12.730916 d4:1b:81:ac:5b:29 > 8a:75:31:15:cb:3e, ethertype IPv4 (0x0800), length 66: 192.168.1.28.1717 > 192.168.1.10.48876: Flags [.], ack 1, win 3864, options [nop,nop,TS val 3894408704 ecr 309230667], length 0
03:45:12.742233 8a:75:31:15:cb:3e > d4:1b:81:ac:5b:29, ethertype IPv4 (0x0800), length 66: 192.168.1.10.48876 > 192.168.1.28.1717: Flags [.], ack 1, win 235, options [nop,nop,TS val 309234619 ecr 3894377998], length 0
03:45:12.957260 20:0c:86:b9:be:60 > d4:1b:81:ac:5b:29, ethertype IPv4 (0x0800), length 165: 13.89.179.14.443 > 192.168.1.28.40206: Flags [P.], seq 336:435, ack 12242, win 16383, options [nop,nop,TS val 992033230 ecr 4225490053], length 99
03:45:12.957277 d4:1b:81:ac:5b:29 > 20:0c:86:b9:be:60, ethertype IPv4 (0x0800), length 66: 192.168.1.28.40206 > 13.89.179.14.443: Flags [.], ack 435, win 501, options [nop,nop,TS val 4225491812 ecr 992033230], length 0
03:45:12.958060 d4:1b:81:ac:5b:29 > 20:0c:86:b9:be:60, ethertype IPv4 (0x0800), length 101: 192.168.1.28.40206 > 13.89.179.14.443: Flags [P.], seq 12242:12277, ack 435, win 501, options [nop,nop,TS val 4225491813 ecr 992033230], length 35
03:45:13.469905 20:0c:86:b9:be:60 > d4:1b:81:ac:5b:29, ethertype IPv4 (0x0800), length 66: 13.89.179.14.443 > 192.168.1.28.40206: Flags [.], ack 12277, win 16383, options [nop,nop,TS val 992033706 ecr 4225491813], length 0
03:45:16.541878 20:0c:86:b9:be:60 > d4:1b:81:ac:5b:29, ethertype IPv4 (0x0800), length 129: 57.144.147.32.5222 > 192.168.1.28.56634: Flags [P.], seq 3718366104:3718366167, ack 4219390995, win 310, options [nop,nop,TS val 2617725722 ecr 1024895222], length 63
03:45:16.541905 d4:1b:81:ac:5b:29 > 20:0c:86:b9:be:60, ethertype IPv4 (0x0800), length 66: 192.168.1.28.56634 > 57.144.147.32.5222: Flags [.], ack 63, win 479, options [nop,nop,TS val 1024940229 ecr 2617725722], length 0
03:45:16.542611 d4:1b:81:ac:5b:29 > 20:0c:86:b9:be:60, ethertype IPv4 (0x0800), length 123: 192.168.1.28.56634 > 57.144.147.32.5222: Flags [P.], seq 1:58, ack 63, win 479, options [nop,nop,TS val 1024940229 ecr 2617725722], length 57
03:45:16.546564 20:0c:86:b9:be:60 > d4:1b:81:ac:5b:29, ethertype IPv4 (0x0800), length 66: 57.144.147.32.5222 > 192.168.1.28.56634: Flags [.], ack 58, win 310, options [nop,nop,TS val 2617725776 ecr 1024940229], length 0
03:45:16.571042 d4:1b:81:ac:5b:29 > 20:0c:86:b9:be:60, ethertype IPv4 (0x0800), length 66: 192.168.1.28.50742 > 18.66.78.15.443: Flags [.], ack 3983006130, win 436, options [nop,nop,TS val 1472657664 ecr 2990351611], length 0
03:45:16.577825 20:0c:86:b9:be:60 > d4:1b:81:ac:5b:29, ethertype IPv4 (0x0800), length 66: 18.66.78.15.443 > 192.168.1.28.50742: Flags [.], ack 1, win 173, options [nop,nop,TS val 2990396694 ecr 1472612587], length 0
03:45:19.391341 d4:1b:81:ac:5b:29 > 20:0c:86:b9:be:60, ethertype IPv4 (0x0800), length 178: 192.168.1.28.40206 > 13.89.179.14.443: Flags [P.], seq 12277:12389, ack 435, win 501, options [nop,nop,TS val 4225498246 ecr 992033706], length 112
03:45:19.391374 d4:1b:81:ac:5b:29 > 20:0c:86:b9:be:60, ethertype IPv4 (0x0800), length 1494: 192.168.1.28.40206 > 13.89.179.14.443: Flags [.], seq 12389:13817, ack 435, win 501, options [nop,nop,TS val 4225498246 ecr 992033706], length 1428
03:45:19.391376 d4:1b:81:ac:5b:29 > 20:0c:86:b9:be:60, ethertype IPv4 (0x0800), length 594: 192.168.1.28.40206 > 13.89.179.14.443: Flags [P.], seq 13817:14345, ack 435, win 501, options [nop,nop,TS val 4225498246 ecr 992033706], length 528
03:45:19.819879 20:0c:86:b9:be:60 > d4:1b:81:ac:5b:29, ethertype IPv4 (0x0800), length 66: 13.89.179.14.443 > 192.168.1.28.40206: Flags [.], ack 14345, win 16385, options [nop,nop,TS val 992039945 ecr 4225498246], length 0
03:45:19.820180 20:0c:86:b9:be:60 > d4:1b:81:ac:5b:29, ethertype IPv4 (0x0800), length 160: 13.89.179.14.443 > 192.168.1.28.40206: Flags [P.], seq 435:529, ack 14345, win 16385, options [nop,nop,TS val 992039976 ecr 4225498246], length 94
03:45:19.821039 d4:1b:81:ac:5b:29 > 20:0c:86:b9:be:60, ethertype IPv4 (0x0800), length 101: 192.168.1.28.40206 > 13.89.179.14.443: Flags [P.], seq 14345:14380, ack 529, win 501, options [nop,nop,TS val 4225498676 ecr 992039976], length 35
03:45:20.228108 20:0c:86:b9:be:60 > d4:1b:81:ac:5b:29, ethertype IPv4 (0x0800), length 66: 13.89.179.14.443 > 192.168.1.28.40206: Flags [.], ack 14380, win 16385, options [nop,nop,TS val 992040518 ecr 4225498676], length 0
03:45:20.239730 8a:75:31:15:cb:3e > d4:1b:81:ac:5b:29, ethertype IPv4 (0x0800), length 279: 192.168.1.10.48876 > 192.168.1.28.1717: Flags [P.], seq 1:214, ack 1, win 235, options [nop,nop,TS val 309239099 ecr 3894377998], length 213
03:45:20.239759 d4:1b:81:ac:5b:29 > 8a:75:31:15:cb:3e, ethertype IPv4 (0x0800), length 66: 192.168.1.28.1717 > 192.168.1.10.48876: Flags [.], ack 214, win 3863, options [nop,nop,TS val 3894416212 ecr 309239099], length 0
03:45:20.276073 8a:75:31:15:cb:3e > d4:1b:81:ac:5b:29, ethertype IPv4 (0x0800), length 279: 192.168.1.10.48876 > 192.168.1.28.1717: Flags [P.], seq 214:427, ack 1, win 235, options [nop,nop,TS val 309239136 ecr 3894416212], length 213
03:45:20.276100 d4:1b:81:ac:5b:29 > 8a:75:31:15:cb:3e, ethertype IPv4 (0x0800), length 66: 192.168.1.28.1717 > 192.168.1.10.48876: Flags [.], ack 427, win 3862, options [nop,nop,TS val 3894416249 ecr 309239136], length 0
03:45:21.047793 8a:75:31:15:cb:3e > d4:1b:81:ac:5b:29, ethertype IPv4 (0x0800), length 279: 192.168.1.10.48876 > 192.168.1.28.1717: Flags [P.], seq 427:640, ack 1, win 235, options [nop,nop,TS val 309239838 ecr 3894416249], length 213
03:45:21.047821 d4:1b:81:ac:5b:29 > 8a:75:31:15:cb:3e, ethertype IPv4 (0x0800), length 66: 192.168.1.28.1717 > 192.168.1.10.48876: Flags [.], ack 640, win 3861, options [nop,nop,TS val 3894417020 ecr 309239838], length 0
03:45:21.947037 d4:1b:81:ac:5b:29 > 20:0c:86:b9:be:60, ethertype IPv4 (0x0800), length 66: 192.168.1.28.55184 > 3.233.158.25.443: Flags [.], ack 465951563, win 529, options [nop,nop,TS val 2221166810 ecr 1379806237], length 0
03:45:22.182963 20:0c:86:b9:be:60 > d4:1b:81:ac:5b:29, ethertype IPv4 (0x0800), length 66: 3.233.158.25.443 > 192.168.1.28.55184: Flags [.], ack 1, win 69, options [nop,nop,TS val 1379851691 ecr 2221121714], length 0
03:45:22.251167 d4:1b:81:ac:5b:29 > 20:0c:86:b9:be:60, ethertype IPv4 (0x0800), length 306: 192.168.1.28.44910 > 35.174.127.31.443: Flags [P.], seq 240:480, ack 264, win 549, options [nop,nop,TS val 1796892461 ecr 1823653854], length 240
03:45:22.275881 d4:1b:81:ac:5b:29 > 8a:75:31:15:cb:3e, ethertype IPv4 (0x0800), length 74: 192.168.1.28.40316 > 192.168.1.10.1716: Flags [S], seq 2211087241, win 64240, options [mss 1460,sackOK,TS val 3894418249 ecr 0,nop,wscale 7], length 0
03:45:22.482267 8a:75:31:15:cb:3e > d4:1b:81:ac:5b:29, ethertype IPv4 (0x0800), length 74: 192.168.1.10.1716 > 192.168.1.28.40316: Flags [S.], seq 34558554, ack 2211087242, win 65535, options [mss 1452,sackOK,TS val 309241257 ecr 3894418249,nop,wscale 9], length 0
03:45:22.482300 d4:1b:81:ac:5b:29 > 8a:75:31:15:cb:3e, ethertype IPv4 (0x0800), length 66: 192.168.1.28.40316 > 192.168.1.10.1716: Flags [.], ack 1, win 502, options [nop,nop,TS val 3894418455 ecr 309241257], length 0
03:45:22.482709 d4:1b:81:ac:5b:29 > 8a:75:31:15:cb:3e, ethertype IPv4 (0x0800), length 1506: 192.168.1.28.40316 > 192.168.1.10.1716: Flags [.], seq 1:1441, ack 1, win 502, options [nop,nop,TS val 3894418455 ecr 309241257], length 1440
03:45:22.482716 d4:1b:81:ac:5b:29 > 8a:75:31:15:cb:3e, ethertype IPv4 (0x0800), length 728: 192.168.1.28.40316 > 192.168.1.10.1716: Flags [P.], seq 1441:2103, ack 1, win 502, options [nop,nop,TS val 3894418455 ecr 309241257], length 662
03:45:22.491418 20:0c:86:b9:be:60 > d4:1b:81:ac:5b:29, ethertype IPv4 (0x0800), length 329: 35.174.127.31.443 > 192.168.1.28.44910: Flags [P.], seq 264:527, ack 480, win 447, options [nop,nop,TS val 1823669853 ecr 1796892461], length 263
03:45:22.491449 d4:1b:81:ac:5b:29 > 20:0c:86:b9:be:60, ethertype IPv4 (0x0800), length 66: 192.168.1.28.44910 > 35.174.127.31.443: Flags [.], ack 527, win 549, options [nop,nop,TS val 1796892701 ecr 1823669853], length 0
03:45:22.550772 8a:75:31:15:cb:3e > d4:1b:81:ac:5b:29, ethertype IPv4 (0x0800), length 66: 192.168.1.10.1716 > 192.168.1.28.40316: Flags [.], ack 1441, win 134, options [nop,nop,TS val 309241411 ecr 3894418455], length 0
03:45:22.550824 8a:75:31:15:cb:3e > d4:1b:81:ac:5b:29, ethertype IPv4 (0x0800), length 66: 192.168.1.10.1716 > 192.168.1.28.40316: Flags [.], ack 2103, win 140, options [nop,nop,TS val 309241411 ecr 3894418455], length 0
03:45:22.788553 8a:75:31:15:cb:3e > d4:1b:81:ac:5b:29, ethertype IPv4 (0x0800), length 204: 192.168.1.10.1716 > 192.168.1.28.40316: Flags [P.], seq 1:139, ack 2103, win 140, options [nop,nop,TS val 309241440 ecr 3894418455], length 138
03:45:22.788579 d4:1b:81:ac:5b:29 > 8a:75:31:15:cb:3e, ethertype IPv4 (0x0800), length 66: 192.168.1.28.40316 > 192.168.1.10.1716: Flags [.], ack 139, win 501, options [nop,nop,TS val 3894418761 ecr 309241440], length 0
03:45:22.789508 d4:1b:81:ac:5b:29 > 8a:75:31:15:cb:3e, ethertype IPv4 (0x0800), length 1421: 192.168.1.28.40316 > 192.168.1.10.1716: Flags [P.], seq 2103:3458, ack 139, win 501, options [nop,nop,TS val 3894418762 ecr 309241440], length 1355
03:45:22.851025 8a:75:31:15:cb:3e > d4:1b:81:ac:5b:29, ethertype IPv4 (0x0800), length 664: 192.168.1.10.1716 > 192.168.1.28.40316: Flags [P.], seq 139:737, ack 3458, win 145, options [nop,nop,TS val 309241713 ecr 3894418762], length 598
03:45:22.870788 d4:1b:81:ac:5b:29 > 8a:75:31:15:cb:3e, ethertype IPv4 (0x0800), length 791: 192.168.1.28.40316 > 192.168.1.10.1716: Flags [P.], seq 3458:4183, ack 737, win 497, options [nop,nop,TS val 3894418843 ecr 309241713], length 725
03:45:23.200386 8a:75:31:15:cb:3e > d4:1b:81:ac:5b:29, ethertype IPv4 (0x0800), length 66: 192.168.1.10.1716 > 192.168.1.28.40316: Flags [.], ack 4183, win 151, options [nop,nop,TS val 309241895 ecr 3894418843], length 0
03:45:23.200386 8a:75:31:15:cb:3e > d4:1b:81:ac:5b:29, ethertype IPv4 (0x0800), length 279: 192.168.1.10.48876 > 192.168.1.28.1717: Flags [P.], seq 640:853, ack 1, win 235, options [nop,nop,TS val 309241920 ecr 3894417020], length 213
03:45:23.200436 d4:1b:81:ac:5b:29 > 8a:75:31:15:cb:3e, ethertype IPv4 (0x0800), length 66: 192.168.1.28.1717 > 192.168.1.10.48876: Flags [.], ack 853, win 3860, options [nop,nop,TS val 3894419173 ecr 309241920], length 0
03:45:24.017267 8a:75:31:15:cb:3e > d4:1b:81:ac:5b:29, ethertype IPv4 (0x0800), length 210: 192.168.1.10.1716 > 192.168.1.28.40316: Flags [P.], seq 737:881, ack 4183, win 151, options [nop,nop,TS val 309242772 ecr 3894418843], length 144
03:45:24.017268 8a:75:31:15:cb:3e > d4:1b:81:ac:5b:29, ethertype IPv4 (0x0800), length 1506: 192.168.1.10.1716 > 192.168.1.28.40316: Flags [.], seq 881:2321, ack 4183, win 151, options [nop,nop,TS val 309242772 ecr 3894418843], length 1440
03:45:24.017302 d4:1b:81:ac:5b:29 > 8a:75:31:15:cb:3e, ethertype IPv4 (0x0800), length 66: 192.168.1.28.40316 > 192.168.1.10.1716: Flags [.], ack 2321, win 521, options [nop,nop,TS val 3894419990 ecr 309242772], length 0
03:45:24.017778 d4:1b:81:ac:5b:29 > 8a:75:31:15:cb:3e, ethertype IPv4 (0x0800), length 302: 192.168.1.28.40316 > 192.168.1.10.1716: Flags [P.], seq 4183:4419, ack 2321, win 521, options [nop,nop,TS val 3894419990 ecr 309242772], length 236
03:45:24.052594 8a:75:31:15:cb:3e > d4:1b:81:ac:5b:29, ethertype IPv4 (0x0800), length 109: 192.168.1.10.1716 > 192.168.1.28.40316: Flags [P.], seq 2321:2364, ack 4183, win 151, options [nop,nop,TS val 309242912 ecr 3894419990], length 43
03:45:24.052595 8a:75:31:15:cb:3e > d4:1b:81:ac:5b:29, ethertype IPv4 (0x0800), length 66: 192.168.1.10.1716 > 192.168.1.28.40316: Flags [.], ack 4419, win 157, options [nop,nop,TS val 309242912 ecr 3894419990], length 0
03:45:24.111040 d4:1b:81:ac:5b:29 > 8a:75:31:15:cb:3e, ethertype IPv4 (0x0800), length 66: 192.168.1.28.40316 > 192.168.1.10.1716: Flags [.], ack 2364, win 521, options [nop,nop,TS val 3894420084 ecr 309242912], length 0
03:45:24.540254 d4:1b:81:ac:5b:29 > 20:0c:86:b9:be:60, ethertype IPv4 (0x0800), length 184: 192.168.1.28.40206 > 13.89.179.14.443: Flags [P.], seq 14380:14498, ack 529, win 501, options [nop,nop,TS val 4225503395 ecr 992040518], length 118
03:45:24.540279 d4:1b:81:ac:5b:29 > 20:0c:86:b9:be:60, ethertype IPv4 (0x0800), length 1494: 192.168.1.28.40206 > 13.89.179.14.443: Flags [.], seq 14498:15926, ack 529, win 501, options [nop,nop,TS val 4225503395 ecr 992040518], length 1428
03:45:24.540281 d4:1b:81:ac:5b:29 > 20:0c:86:b9:be:60, ethertype IPv4 (0x0800), length 1494: 192.168.1.28.40206 > 13.89.179.14.443: Flags [P.], seq 15926:17354, ack 529, win 501, options [nop,nop,TS val 4225503395 ecr 992040518], length 1428
03:45:24.542019 d4:1b:81:ac:5b:29 > 20:0c:86:b9:be:60, ethertype IPv4 (0x0800), length 1091: 192.168.1.28.40206 > 13.89.179.14.443: Flags [P.], seq 17354:18379, ack 529, win 501, options [nop,nop,TS val 4225503397 ecr 992040518], length 1025
03:45:24.836557 20:0c:86:b9:be:60 > d4:1b:81:ac:5b:29, ethertype IPv4 (0x0800), length 66: 13.89.179.14.443 > 192.168.1.28.40206: Flags [.], ack 15926, win 16385, options [nop,nop,TS val 992045092 ecr 4225503395], length 0
03:45:24.836617 20:0c:86:b9:be:60 > d4:1b:81:ac:5b:29, ethertype IPv4 (0x0800), length 66: 13.89.179.14.443 > 192.168.1.28.40206: Flags [.], ack 18379, win 16385, options [nop,nop,TS val 992045094 ecr 4225503395], length 0
03:45:27.089875 20:0c:86:b9:be:60 > d4:1b:81:ac:5b:29, ethertype IPv4 (0x0800), length 165: 13.89.179.14.443 > 192.168.1.28.40206: Flags [P.], seq 529:628, ack 18379, win 16385, options [nop,nop,TS val 992047142 ecr 4225503395], length 99
03:45:27.090793 d4:1b:81:ac:5b:29 > 20:0c:86:b9:be:60, ethertype IPv4 (0x0800), length 101: 192.168.1.28.40206 > 13.89.179.14.443: Flags [P.], seq 18379:18414, ack 628, win 501, options [nop,nop,TS val 4225505945 ecr 992047142], length 35
03:45:27.323058 d4:1b:81:ac:5b:29 > 20:0c:86:b9:be:60, ethertype IPv4 (0x0800), length 66: 192.168.1.28.60632 > 104.18.32.47.443: Flags [.], ack 214017039, win 549, options [nop,nop,TS val 2331438284 ecr 3117726276], length 0
03:45:27.357123 20:0c:86:b9:be:60 > d4:1b:81:ac:5b:29, ethertype IPv4 (0x0800), length 66: 104.18.32.47.443 > 192.168.1.28.60632: Flags [.], ack 1, win 19, options [nop,nop,TS val 3117771332 ecr 2331302783], length 0
03:45:27.409215 20:0c:86:b9:be:60 > d4:1b:81:ac:5b:29, ethertype IPv4 (0x0800), length 66: 13.89.179.14.443 > 192.168.1.28.40206: Flags [.], ack 18414, win 16385, options [nop,nop,TS val 992047721 ecr 4225505945], length 0
03:45:27.876006 8a:75:31:15:cb:3e > d4:1b:81:ac:5b:29, ethertype IPv4 (0x0800), length 279: 192.168.1.10.48876 > 192.168.1.28.1717: Flags [P.], seq 853:1066, ack 1, win 235, options [nop,nop,TS val 309246679 ecr 3894419173], length 213
03:45:27.876031 d4:1b:81:ac:5b:29 > 8a:75:31:15:cb:3e, ethertype IPv4 (0x0800), length 66: 192.168.1.28.1717 > 192.168.1.10.48876: Flags [.], ack 1066, win 3859, options [nop,nop,TS val 3894423849 ecr 309246679], length 0
03:45:27.879175 8a:75:31:15:cb:3e > d4:1b:81:ac:5b:29, ethertype IPv4 (0x0800), length 279: 192.168.1.10.1716 > 192.168.1.28.40316: Flags [P.], seq 2364:2577, ack 4419, win 157, options [nop,nop,TS val 309246679 ecr 3894420084], length 213
03:45:27.879204 d4:1b:81:ac:5b:29 > 8a:75:31:15:cb:3e, ethertype IPv4 (0x0800), length 66: 192.168.1.28.40316 > 192.168.1.10.1716: Flags [.], ack 2577, win 521, options [nop,nop,TS val 3894423852 ecr 309246679], length 0
03:45:29.371034 d4:1b:81:ac:5b:29 > 20:0c:86:b9:be:60, ethertype IPv4 (0x0800), length 66: 192.168.1.28.58518 > 172.64.155.209.443: Flags [.], ack 454597629, win 492, options [nop,nop,TS val 1653158147 ecr 936375586], length 0
03:45:29.519089 20:0c:86:b9:be:60 > d4:1b:81:ac:5b:29, ethertype IPv4 (0x0800), length 66: 172.64.155.209.443 > 192.168.1.28.58518: Flags [.], ack 1, win 19, options [nop,nop,TS val 936421990 ecr 1653111843], length 0
03:45:29.631175 d4:1b:81:ac:5b:29 > 20:0c:86:b9:be:60, ethertype IPv4 (0x0800), length 178: 192.168.1.28.40206 > 13.89.179.14.443: Flags [P.], seq 18414:18526, ack 628, win 501, options [nop,nop,TS val 4225508486 ecr 992047721], length 112
03:45:29.631207 d4:1b:81:ac:5b:29 > 20:0c:86:b9:be:60, ethertype IPv4 (0x0800), length 1494: 192.168.1.28.40206 > 13.89.179.14.443: Flags [.], seq 18526:19954, ack 628, win 501, options [nop,nop,TS val 4225508486 ecr 992047721], length 1428
03:45:29.631207 d4:1b:81:ac:5b:29 > 20:0c:86:b9:be:60, ethertype IPv4 (0x0800), length 1494: 192.168.1.28.40206 > 13.89.179.14.443: Flags [P.], seq 19954:21382, ack 628, win 501, options [nop,nop,TS val 4225508486 ecr 992047721], length 1428
03:45:29.721570 d4:1b:81:ac:5b:29 > 20:0c:86:b9:be:60, ethertype IPv4 (0x0800), length 1091: 192.168.1.28.40206 > 13.89.179.14.443: Flags [P.], seq 21382:22407, ack 628, win 501, options [nop,nop,TS val 4225508576 ecr 992047721], length 1025
03:45:29.958187 20:0c:86:b9:be:60 > d4:1b:81:ac:5b:29, ethertype IPv4 (0x0800), length 66: 13.89.179.14.443 > 192.168.1.28.40206: Flags [.], ack 21382, win 16385, options [nop,nop,TS val 992050272 ecr 4225508486], length 0
03:45:29.959367 20:0c:86:b9:be:60 > d4:1b:81:ac:5b:29, ethertype IPv4 (0x0800), length 66: 13.89.179.14.443 > 192.168.1.28.40206: Flags [.], ack 22407, win 16381, options [nop,nop,TS val 992050273 ecr 4225508576], length 0
03:45:30.132142 8a:75:31:15:cb:3e > d4:1b:81:ac:5b:29, ethertype IPv4 (0x0800), length 279: 192.168.1.10.1716 > 192.168.1.28.40316: Flags [P.], seq 2577:2790, ack 4419, win 157, options [nop,nop,TS val 309248951 ecr 3894423852], length 213
03:45:30.132142 8a:75:31:15:cb:3e > d4:1b:81:ac:5b:29, ethertype IPv4 (0x0800), length 279: 192.168.1.10.48876 > 192.168.1.28.1717: Flags [P.], seq 1066:1279, ack 1, win 235, options [nop,nop,TS val 309248955 ecr 3894423849], length 213
03:45:30.132142 20:0c:86:b9:be:60 > d4:1b:81:ac:5b:29, ethertype IPv4 (0x0800), length 165: 13.89.179.14.443 > 192.168.1.28.40206: Flags [P.], seq 628:727, ack 22407, win 16381, options [nop,nop,TS val 992050419 ecr 4225508576], length 99
03:45:30.132187 d4:1b:81:ac:5b:29 > 8a:75:31:15:cb:3e, ethertype IPv4 (0x0800), length 66: 192.168.1.28.40316 > 192.168.1.10.1716: Flags [.], ack 2790, win 521, options [nop,nop,TS val 3894426105 ecr 309248951], length 0
03:45:30.132199 d4:1b:81:ac:5b:29 > 8a:75:31:15:cb:3e, ethertype IPv4 (0x0800), length 66: 192.168.1.28.1717 > 192.168.1.10.48876: Flags [.], ack 1279, win 3858, options [nop,nop,TS val 3894426105 ecr 309248955], length 0
03:45:30.174934 d4:1b:81:ac:5b:29 > 20:0c:86:b9:be:60, ethertype IPv4 (0x0800), length 66: 192.168.1.28.40206 > 13.89.179.14.443: Flags [.], ack 727, win 501, options [nop,nop,TS val 4225509030 ecr 992050419], length 0
03:45:31.251915 d4:1b:81:ac:5b:29 > 20:0c:86:b9:be:60, ethertype IPv4 (0x0800), length 205: 192.168.1.28.44910 > 35.174.127.31.443: Flags [P.], seq 480:619, ack 527, win 549, options [nop,nop,TS val 1796901462 ecr 1823669853], length 139
03:45:31.252923 d4:1b:81:ac:5b:29 > 20:0c:86:b9:be:60, ethertype IPv4 (0x0800), length 98: 192.168.1.28.50742 > 18.66.78.15.443: Flags [P.], seq 1:33, ack 1, win 436, options [nop,nop,TS val 1472672346 ecr 2990396694], length 32
03:45:31.253445 d4:1b:81:ac:5b:29 > 20:0c:86:b9:be:60, ethertype IPv4 (0x0800), length 135: 192.168.1.28.56634 > 57.144.147.32.5222: Flags [P.], seq 58:127, ack 63, win 479, options [nop,nop,TS val 1024954940 ecr 2617725776], length 69
03:45:31.368901 20:0c:86:b9:be:60 > d4:1b:81:ac:5b:29, ethertype IPv4 (0x0800), length 66: 57.144.147.32.5222 > 192.168.1.28.56634: Flags [.], ack 127, win 310, options [nop,nop,TS val 2617740597 ecr 1024954940], length 0
03:45:31.370490 20:0c:86:b9:be:60 > d4:1b:81:ac:5b:29, ethertype IPv4 (0x0800), length 66: 18.66.78.15.443 > 192.168.1.28.50742: Flags [.], ack 33, win 173, options [nop,nop,TS val 2990411486 ecr 1472672346], length 0
03:45:31.597105 20:0c:86:b9:be:60 > d4:1b:81:ac:5b:29, ethertype IPv4 (0x0800), length 137: 57.144.147.32.5222 > 192.168.1.28.56634: Flags [P.], seq 63:134, ack 127, win 310, options [nop,nop,TS val 2617740826 ecr 1024954940], length 71
03:45:31.599713 20:0c:86:b9:be:60 > d4:1b:81:ac:5b:29, ethertype IPv4 (0x0800), length 94: 18.66.78.15.443 > 192.168.1.28.50742: Flags [P.], seq 1:29, ack 33, win 173, options [nop,nop,TS val 2990411717 ecr 1472672346], length 28
03:45:31.599739 d4:1b:81:ac:5b:29 > 20:0c:86:b9:be:60, ethertype IPv4 (0x0800), length 66: 192.168.1.28.50742 > 18.66.78.15.443: Flags [.], ack 29, win 436, options [nop,nop,TS val 1472672692 ecr 2990411717], length 0
03:45:31.638997 d4:1b:81:ac:5b:29 > 20:0c:86:b9:be:60, ethertype IPv4 (0x0800), length 66: 192.168.1.28.56634 > 57.144.147.32.5222: Flags [.], ack 134, win 479, options [nop,nop,TS val 1024955326 ecr 2617740826], length 0
03:45:31.743039 d4:1b:81:ac:5b:29 > 20:0c:86:b9:be:60, ethertype IPv4 (0x0800), length 205: 192.168.1.28.44910 > 35.174.127.31.443: Flags [P.], seq 480:619, ack 527, win 549, options [nop,nop,TS val 1796901953 ecr 1823669853], length 139
03:45:31.776645 20:0c:86:b9:be:60 > d4:1b:81:ac:5b:29, ethertype IPv4 (0x0800), length 66: 35.174.127.31.443 > 192.168.1.28.44910: Flags [.], ack 619, win 452, options [nop,nop,TS val 1823679011 ecr 1796901462], length 0
03:45:32.015485 20:0c:86:b9:be:60 > d4:1b:81:ac:5b:29, ethertype IPv4 (0x0800), length 78: 35.174.127.31.443 > 192.168.1.28.44910: Flags [.], ack 619, win 452, options [nop,nop,TS val 1823679376 ecr 1796901953,nop,nop,sack 1 {480:619}], length 0
